CPU 0:
CPUID 00000000:00 = 00000001 68747541 444d4163 69746e65 | ....AuthcAMDenti
CPUID 00000001:00 = 00000570 00000000 00000000 008001bf | p...............
CPUID 40000000:00 = 00000000 00000000 00000000 00000000 | ................
CPUID 80000000:00 = 80000005 00000000 00000000 00000000 | ................
CPUID 80000001:00 = 00000670 00000000 00000000 008005bf | p...............
CPUID 80000002:00 = 2d444d41 6d74364b 202f7720 746c756d | AMD-K6tm w/ mult
CPUID 80000003:00 = 64656d69 65206169 6e657478 6e6f6973 | imedia extension
CPUID 80000004:00 = 00000073 00000000 00000000 00000000 | s...............
CPUID 80000005:00 = 00000000 02800140 20020220 20020220 | ....@... ..  .. 
CPUID 80860000:00 = 00000000 00000000 00000000 00000000 | ................
CPUID c0000000:00 = 00000000 00000000 00000000 00000000 | ................
