CPU 0:
CPUID 00000000:00 = 00000001 68747541 444d4163 69746e65 | ....AuthcAMDenti
CPUID 00000001:00 = 000006a0 00000000 00000000 0383fbff | ................
CPUID 40000000:00 = 00000000 00000000 00000000 00000000 | ................
CPUID 80000000:00 = 80000008 68747541 444d4163 69746e65 | ....AuthcAMDenti
CPUID 80000001:00 = 000007a0 00000000 00000000 c1c3fbff | ................
CPUID 80000002:00 = 20444d41 6c687441 74286e6f 5820296d | AMD Athlon(tm) X
CPUID 80000003:00 = 32332050 002b3030 00000000 00000000 | P 3200+.........
CPUID 80000004:00 = 00000000 00000000 00000000 00000000 | ................
CPUID 80000005:00 = 0408ff08 ff20ff10 40020140 40020140 | ...... .@..@@..@
CPUID 80000006:00 = 00000000 41004100 02008140 00000000 | .....A.A@.......
CPUID 80000007:00 = 00000000 00000000 00000000 00000001 | ................
CPUID 80000008:00 = 00002022 00000000 00000000 00000000 | " ..............
CPUID 80860000:00 = 00000000 00000000 00000000 00000000 | ................
CPUID c0000000:00 = 00000000 00000000 00000000 00000000 | ................
