CPU 0:
CPUID 00000000:00 = 00000001 68747541 444d4163 69746e65 | ....AuthcAMDenti
CPUID 00000001:00 = 000005d0 00000000 00000000 008021bf | .............!..
CPUID 40000000:00 = 00000000 00000000 00000000 00000000 | ................
CPUID 80000000:00 = 80000007 00000000 00000000 00000000 | ................
CPUID 80000001:00 = 000006d0 00000000 00000000 c08029bf | .............)..
CPUID 80000002:00 = 2d444d41 7428364b 492d296d 50204949 | AMD-K6(tm)-III P
CPUID 80000003:00 = 65636f72 726f7373 00000000 00000000 | rocessor........
CPUID 80000004:00 = 00000000 00000000 00000000 00000000 | ................
CPUID 80000005:00 = 00000000 02800140 20020220 20020220 | ....@... ..  .. 
CPUID 80000006:00 = 00000000 00000000 01004220 00000000 | ........ B......
CPUID 80000007:00 = 00000000 00000000 00000000 00000007 | ................
CPUID 80860000:00 = 00000000 00000000 00000000 00000000 | ................
CPUID c0000000:00 = 00000000 00000000 00000000 00000000 | ................
