CPU 0:
CPUID 00000000:00 = 00000001 68747541 444d4163 69746e65 | ....AuthcAMDenti
CPUID 00000001:00 = 000005a2 00000400 00000000 0088a93d | ............=...
CPUID 40000000:00 = 00000000 00000000 00000000 00000000 | ................
CPUID 80000000:00 = 80000006 68747541 444d4163 69746e65 | ....AuthcAMDenti
CPUID 80000001:00 = 000005a2 00000000 00000000 c0c0a13d | ............=...
CPUID 80000002:00 = 646f6547 4d542865 6e492029 72676574 | Geode(TM) Integr
CPUID 80000003:00 = 64657461 6f725020 73736563 6220726f | ated Processor b
CPUID 80000004:00 = 4d412079 43502044 00000053 00000000 | y AMD PCS.......
CPUID 80000005:00 = 00000000 ff10ff10 40100120 40100120 | ........ ..@ ..@
CPUID 80000006:00 = 0000f004 00002040 00804120 00000000 | ....@ .. A......
CPUID 80860000:00 = 00000000 00000000 00000000 00000000 | ................
CPUID c0000000:00 = 00000000 00000000 00000000 00000000 | ................
