CPU 0:
CPUID 00000000:00 = 00000001 68747541 444d4163 69746e65 | ....AuthcAMDenti
CPUID 00000001:00 = 00000612 00000000 00000000 0081f9ff | ................
CPUID 40000000:00 = 00000000 00000000 00000000 00000000 | ................
CPUID 80000000:00 = 80000006 68747541 444d4163 69746e65 | ....AuthcAMDenti
CPUID 80000001:00 = 00000712 00000000 00000000 c0c1f9ff | ................
CPUID 80000002:00 = 2d444d41 7428374b 5020296d 65636f72 | AMD-K7(tm) Proce
CPUID 80000003:00 = 726f7373 00000000 00000000 00000000 | ssor............
CPUID 80000004:00 = 00000000 00000000 00000000 00000000 | ................
CPUID 80000005:00 = 0408ff08 ff18ff10 40020140 40020140 | ........@..@@..@
CPUID 80000006:00 = 00000000 41004100 02002140 00000000 | .....A.A@!......
CPUID 80860000:00 = 00000000 00000000 00000000 00000000 | ................
CPUID c0000000:00 = 00000000 00000000 00000000 00000000 | ................
