CPU 0:
CPUID 00000000:00 = 0000000d 68747541 444d4163 69746e65 | ....AuthcAMDenti
CPUID 00000001:00 = 00700f01 00040800 bed82203 178bfbff | ..p......"......
CPUID 00000002:00 = 00000000 00000000 00000000 00000000 | ................
CPUID 00000003:00 = 00000000 00000000 00000000 00000000 | ................
CPUID 00000004:00 = 00000000 00000000 00000000 00000000 | ................
CPUID 00000005:00 = 00000000 00000000 00000000 00000000 | ................
CPUID 00000006:00 = 00000000 00000000 00000001 00000000 | ................
CPUID 00000007:00 = 00000000 00000008 00000000 00000000 | ................
CPUID 00000008:00 = 00000000 00000000 00000000 00000000 | ................
CPUID 00000009:00 = 00000000 00000000 00000000 00000000 | ................
CPUID 0000000a:00 = 00000000 00000000 00000000 00000000 | ................
CPUID 0000000b:00 = 00000000 00000000 00000000 00000000 | ................
CPUID 0000000c:00 = 00000000 00000000 00000000 00000000 | ................
CPUID 0000000d:00 = 00000007 00000340 00000340 00000000 | ....@...@.......
CPUID 0000000d:01 = 00000001 00000000 00000000 00000000 | ................
CPUID 40000000:00 = 4000000b 7263694d 666f736f 76482074 | ...@Microsoft Hv
CPUID 40000001:00 = 31237648 00000000 00000000 00000000 | Hv#1............
CPUID 40000002:00 = 000047ba 000a0000 00000001 00000473 | .G..........s...
CPUID 40000003:00 = 00003fff 002bb9ff 00000002 10fffbf2 | .?....+.........
CPUID 40000004:00 = 00042d1c 00000000 00000000 00000000 | .-..............
CPUID 40000005:00 = 00000140 00000200 00000324 00000000 | @.......$.......
CPUID 40000006:00 = 0002020e 00000000 00000000 00000000 | ................
CPUID 40000007:00 = 80000007 00000003 00000000 00000000 | ................
CPUID 40000008:00 = 00000000 00000000 00000000 00000000 | ................
CPUID 40000009:00 = 00000000 00000000 00000000 00000000 | ................
CPUID 4000000a:00 = 00000000 00000000 00000000 00000000 | ................
CPUID 4000000b:00 = 00000000 00000000 00000000 00000000 | ................
CPUID 80000000:00 = 8000001e 68747541 444d4163 69746e65 | ....AuthcAMDenti
CPUID 80000001:00 = 00700f01 10000000 004023f3 2fd3fbff | ..p......#@..../
CPUID 80000002:00 = 20444d41 6c687441 35206e6f 20303733 | AMD Athlon 5370 
CPUID 80000003:00 = 20555041 68746977 64615220 206e6f65 | APU with Radeon 
CPUID 80000004:00 = 20203352 20202020 20202020 00202020 | R3             .
CPUID 80000005:00 = ff08ff08 ff28ff20 20080140 20020140 | .... .(.@.. @.. 
CPUID 80000006:00 = 21000000 42004200 08008140 00000000 | ...!.B.B@.......
CPUID 80000007:00 = 00000000 00000000 00000000 000001c9 | ................
CPUID 80000008:00 = 00003028 02000000 00003003 00000000 | (0.......0......
CPUID 80000009:00 = 00000000 00000000 00000000 00000000 | ................
CPUID 8000000a:00 = 00000000 00000000 00000000 00000000 | ................
CPUID 8000000b:00 = 00000000 00000000 00000000 00000000 | ................
CPUID 8000000c:00 = 00000000 00000000 00000000 00000000 | ................
CPUID 8000000d:00 = 00000000 00000000 00000000 00000000 | ................
CPUID 8000000e:00 = 00000000 00000000 00000000 00000000 | ................
CPUID 8000000f:00 = 00000000 00000000 00000000 00000000 | ................
CPUID 80000010:00 = 00000000 00000000 00000000 00000000 | ................
CPUID 80000011:00 = 00000000 00000000 00000000 00000000 | ................
CPUID 80000012:00 = 00000000 00000000 00000000 00000000 | ................
CPUID 80000013:00 = 00000000 00000000 00000000 00000000 | ................
CPUID 80000014:00 = 00000000 00000000 00000000 00000000 | ................
CPUID 80000015:00 = 00000000 00000000 00000000 00000000 | ................
CPUID 80000016:00 = 00000000 00000000 00000000 00000000 | ................
CPUID 80000017:00 = 00000000 00000000 00000000 00000000 | ................
CPUID 80000018:00 = 00000000 00000000 00000000 00000000 | ................
CPUID 80000019:00 = 00000000 00000000 00000000 00000000 | ................
CPUID 8000001a:00 = 00000003 00000000 00000000 00000000 | ................
CPUID 8000001b:00 = 00000000 00000000 00000000 00000000 | ................
CPUID 8000001c:00 = 00000000 00000000 00000000 00000000 | ................
CPUID 8000001d:00 = 00000121 01c0003f 0000003f 00000000 | !...?...?.......
CPUID 8000001d:01 = 00000122 0040003f 000000ff 00000000 | "...?.@.........
CPUID 8000001d:02 = 0000c143 03c0003f 000007ff 00000002 | C...?...........
CPUID 8000001e:00 = 00000000 00000000 00000000 00000000 | ................
CPUID 80860000:00 = 00000000 00000000 00000000 00000000 | ................
CPUID c0000000:00 = 00000000 00000000 00000000 00000000 | ................
