CPU 0:
CPUID 00000000:00 = 00000001 68747541 444d4163 69746e65 | ....AuthcAMDenti
CPUID 00000001:00 = 00000644 00000000 00000000 0183f9ff | D...............
CPUID 40000000:00 = 00000000 00000000 00000000 00000000 | ................
CPUID 80000000:00 = 80000006 68747541 444d4163 69746e65 | ....AuthcAMDenti
CPUID 80000001:00 = 00000744 00000000 00000000 c1c7f9ff | D...............
CPUID 80000002:00 = 20444d41 6c687441 74286e6f 5020296d | AMD Athlon(tm) P
CPUID 80000003:00 = 65636f72 726f7373 00000000 00000000 | rocessor........
CPUID 80000004:00 = 00000000 00000000 00000000 00000000 | ................
CPUID 80000005:00 = 0408ff08 ff18ff10 40020140 40020140 | ........@..@@..@
CPUID 80000006:00 = 00000000 41004100 01008140 00000000 | .....A.A@.......
CPUID 80860000:00 = 00000000 00000000 00000000 00000000 | ................
CPUID c0000000:00 = 00000000 00000000 00000000 00000000 | ................
