CPU 0:
CPUID 00000000:00 = 0000000d 68747541 444d4163 69746e65 | ....AuthcAMDenti
CPUID 00000001:00 = 00700f01 00040800 3ed8220b 178bfbff | ..p......".>....
CPUID 00000002:00 = 00000000 00000000 00000000 00000000 | ................
CPUID 00000003:00 = 00000000 00000000 00000000 00000000 | ................
CPUID 00000004:00 = 00000000 00000000 00000000 00000000 | ................
CPUID 00000005:00 = 00000040 00000040 00000003 00000000 | @...@...........
CPUID 00000006:00 = 00000000 00000000 00000001 00000000 | ................
CPUID 00000007:00 = 00000000 00000008 00000000 00000000 | ................
CPUID 00000008:00 = 00000000 00000000 00000000 00000000 | ................
CPUID 00000009:00 = 00000000 00000000 00000000 00000000 | ................
CPUID 0000000a:00 = 00000000 00000000 00000000 00000000 | ................
CPUID 0000000b:00 = 00000000 00000000 00000000 00000000 | ................
CPUID 0000000c:00 = 00000000 00000000 00000000 00000000 | ................
CPUID 0000000d:00 = 00000007 00000340 00000340 00000000 | ....@...@.......
CPUID 0000000d:01 = 00000001 00000000 00000000 00000000 | ................
CPUID 0000000d:02 = 00000100 00000240 00000000 00000000 | ....@...........
CPUID 40000000:00 = 00000000 00000000 00000000 00000000 | ................
CPUID 80000000:00 = 8000001e 68747541 444d4163 69746e65 | ....AuthcAMDenti
CPUID 80000001:00 = 00700f01 10000000 154037ff 2fd3fbff | ..p......7@..../
CPUID 80000002:00 = 20444d41 6c687441 74286e6f 3520296d | AMD Athlon(tm) 5
CPUID 80000003:00 = 20303533 20555041 68746977 64615220 | 350 APU with Rad
CPUID 80000004:00 = 286e6f65 20296d74 20203352 00202020 | eon(tm) R3     .
CPUID 80000005:00 = ff08ff08 ff28ff20 20080140 20020140 | .... .(.@.. @.. 
CPUID 80000006:00 = 21000000 42004200 08008140 00000000 | ...!.B.B@.......
CPUID 80000007:00 = 0d6b0101 00000001 00000000 000009d9 | ..k.............
CPUID 80000008:00 = 00003028 00000000 00003003 00000000 | (0.......0......
CPUID 80000009:00 = 00000000 00000000 00000000 00000000 | ................
CPUID 8000000a:00 = 00000001 00000008 00000000 00001cdf | ................
CPUID 8000000b:00 = 00000000 00000000 00000000 00000000 | ................
CPUID 8000000c:00 = 00000000 00000000 00000000 00000000 | ................
CPUID 8000000d:00 = 00000000 00000000 00000000 00000000 | ................
CPUID 8000000e:00 = 00000000 00000000 00000000 00000000 | ................
CPUID 8000000f:00 = 00000000 00000000 00000000 00000000 | ................
CPUID 80000010:00 = 00000000 00000000 00000000 00000000 | ................
CPUID 80000011:00 = 00000000 00000000 00000000 00000000 | ................
CPUID 80000012:00 = 00000000 00000000 00000000 00000000 | ................
CPUID 80000013:00 = 00000000 00000000 00000000 00000000 | ................
CPUID 80000014:00 = 00000000 00000000 00000000 00000000 | ................
CPUID 80000015:00 = 00000000 00000000 00000000 00000000 | ................
CPUID 80000016:00 = 00000000 00000000 00000000 00000000 | ................
CPUID 80000017:00 = 00000000 00000000 00000000 00000000 | ................
CPUID 80000018:00 = 00000000 00000000 00000000 00000000 | ................
CPUID 80000019:00 = 00000000 00000000 00000000 00000000 | ................
CPUID 8000001a:00 = 00000003 00000000 00000000 00000000 | ................
CPUID 8000001b:00 = 000000ff 00000000 00000000 00000000 | ................
CPUID 8000001c:00 = 00000000 00000000 00000000 00000000 | ................
CPUID 8000001d:00 = 00000121 01c0003f 0000003f 00000000 | !...?...?.......
CPUID 8000001d:01 = 00000122 0040003f 000000ff 00000000 | "...?.@.........
CPUID 8000001d:02 = 0000c143 03c0003f 000007ff 00000002 | C...?...........
CPUID 8000001e:00 = 00000000 00000000 00000000 00000000 | ................
CPUID 80860000:00 = 00000000 00000000 00000000 00000000 | ................
CPUID c0000000:00 = 00000000 00000000 00000000 00000000 | ................
CPU 1:
CPUID 00000000:00 = 0000000d 68747541 444d4163 69746e65 | ....AuthcAMDenti
CPUID 00000001:00 = 00700f01 01040800 3ed8220b 178bfbff | ..p......".>....
CPUID 00000002:00 = 00000000 00000000 00000000 00000000 | ................
CPUID 00000003:00 = 00000000 00000000 00000000 00000000 | ................
CPUID 00000004:00 = 00000000 00000000 00000000 00000000 | ................
CPUID 00000005:00 = 00000040 00000040 00000003 00000000 | @...@...........
CPUID 00000006:00 = 00000000 00000000 00000001 00000000 | ................
CPUID 00000007:00 = 00000000 00000008 00000000 00000000 | ................
CPUID 00000008:00 = 00000000 00000000 00000000 00000000 | ................
CPUID 00000009:00 = 00000000 00000000 00000000 00000000 | ................
CPUID 0000000a:00 = 00000000 00000000 00000000 00000000 | ................
CPUID 0000000b:00 = 00000000 00000000 00000000 00000000 | ................
CPUID 0000000c:00 = 00000000 00000000 00000000 00000000 | ................
CPUID 0000000d:00 = 00000007 00000340 00000340 00000000 | ....@...@.......
CPUID 0000000d:01 = 00000001 00000000 00000000 00000000 | ................
CPUID 0000000d:02 = 00000100 00000240 00000000 00000000 | ....@...........
CPUID 40000000:00 = 00000000 00000000 00000000 00000000 | ................
CPUID 80000000:00 = 8000001e 68747541 444d4163 69746e65 | ....AuthcAMDenti
CPUID 80000001:00 = 00700f01 10000000 154037ff 2fd3fbff | ..p......7@..../
CPUID 80000002:00 = 20444d41 6c687441 74286e6f 3520296d | AMD Athlon(tm) 5
CPUID 80000003:00 = 20303533 20555041 68746977 64615220 | 350 APU with Rad
CPUID 80000004:00 = 286e6f65 20296d74 20203352 00202020 | eon(tm) R3     .
CPUID 80000005:00 = ff08ff08 ff28ff20 20080140 20020140 | .... .(.@.. @.. 
CPUID 80000006:00 = 21000000 42004200 08008140 00000000 | ...!.B.B@.......
CPUID 80000007:00 = 0d6b0101 00000001 00000000 000009d9 | ..k.............
CPUID 80000008:00 = 00003028 00000000 00003003 00000000 | (0.......0......
CPUID 80000009:00 = 00000000 00000000 00000000 00000000 | ................
CPUID 8000000a:00 = 00000001 00000008 00000000 00001cdf | ................
CPUID 8000000b:00 = 00000000 00000000 00000000 00000000 | ................
CPUID 8000000c:00 = 00000000 00000000 00000000 00000000 | ................
CPUID 8000000d:00 = 00000000 00000000 00000000 00000000 | ................
CPUID 8000000e:00 = 00000000 00000000 00000000 00000000 | ................
CPUID 8000000f:00 = 00000000 00000000 00000000 00000000 | ................
CPUID 80000010:00 = 00000000 00000000 00000000 00000000 | ................
CPUID 80000011:00 = 00000000 00000000 00000000 00000000 | ................
CPUID 80000012:00 = 00000000 00000000 00000000 00000000 | ................
CPUID 80000013:00 = 00000000 00000000 00000000 00000000 | ................
CPUID 80000014:00 = 00000000 00000000 00000000 00000000 | ................
CPUID 80000015:00 = 00000000 00000000 00000000 00000000 | ................
CPUID 80000016:00 = 00000000 00000000 00000000 00000000 | ................
CPUID 80000017:00 = 00000000 00000000 00000000 00000000 | ................
CPUID 80000018:00 = 00000000 00000000 00000000 00000000 | ................
CPUID 80000019:00 = 00000000 00000000 00000000 00000000 | ................
CPUID 8000001a:00 = 00000003 00000000 00000000 00000000 | ................
CPUID 8000001b:00 = 000000ff 00000000 00000000 00000000 | ................
CPUID 8000001c:00 = 00000000 00000000 00000000 00000000 | ................
CPUID 8000001d:00 = 00000121 01c0003f 0000003f 00000000 | !...?...?.......
CPUID 8000001d:01 = 00000122 0040003f 000000ff 00000000 | "...?.@.........
CPUID 8000001d:02 = 0000c143 03c0003f 000007ff 00000002 | C...?...........
CPUID 8000001e:00 = 00000001 00000001 00000000 00000000 | ................
CPUID 80860000:00 = 00000000 00000000 00000000 00000000 | ................
CPUID c0000000:00 = 00000000 00000000 00000000 00000000 | ................
CPU 2:
CPUID 00000000:00 = 0000000d 68747541 444d4163 69746e65 | ....AuthcAMDenti
CPUID 00000001:00 = 00700f01 02040800 3ed8220b 178bfbff | ..p......".>....
CPUID 00000002:00 = 00000000 00000000 00000000 00000000 | ................
CPUID 00000003:00 = 00000000 00000000 00000000 00000000 | ................
CPUID 00000004:00 = 00000000 00000000 00000000 00000000 | ................
CPUID 00000005:00 = 00000040 00000040 00000003 00000000 | @...@...........
CPUID 00000006:00 = 00000000 00000000 00000001 00000000 | ................
CPUID 00000007:00 = 00000000 00000008 00000000 00000000 | ................
CPUID 00000008:00 = 00000000 00000000 00000000 00000000 | ................
CPUID 00000009:00 = 00000000 00000000 00000000 00000000 | ................
CPUID 0000000a:00 = 00000000 00000000 00000000 00000000 | ................
CPUID 0000000b:00 = 00000000 00000000 00000000 00000000 | ................
CPUID 0000000c:00 = 00000000 00000000 00000000 00000000 | ................
CPUID 0000000d:00 = 00000007 00000340 00000340 00000000 | ....@...@.......
CPUID 0000000d:01 = 00000001 00000000 00000000 00000000 | ................
CPUID 0000000d:02 = 00000100 00000240 00000000 00000000 | ....@...........
CPUID 40000000:00 = 00000000 00000000 00000000 00000000 | ................
CPUID 80000000:00 = 8000001e 68747541 444d4163 69746e65 | ....AuthcAMDenti
CPUID 80000001:00 = 00700f01 10000000 154037ff 2fd3fbff | ..p......7@..../
CPUID 80000002:00 = 20444d41 6c687441 74286e6f 3520296d | AMD Athlon(tm) 5
CPUID 80000003:00 = 20303533 20555041 68746977 64615220 | 350 APU with Rad
CPUID 80000004:00 = 286e6f65 20296d74 20203352 00202020 | eon(tm) R3     .
CPUID 80000005:00 = ff08ff08 ff28ff20 20080140 20020140 | .... .(.@.. @.. 
CPUID 80000006:00 = 21000000 42004200 08008140 00000000 | ...!.B.B@.......
CPUID 80000007:00 = 0d6b0101 00000001 00000000 000009d9 | ..k.............
CPUID 80000008:00 = 00003028 00000000 00003003 00000000 | (0.......0......
CPUID 80000009:00 = 00000000 00000000 00000000 00000000 | ................
CPUID 8000000a:00 = 00000001 00000008 00000000 00001cdf | ................
CPUID 8000000b:00 = 00000000 00000000 00000000 00000000 | ................
CPUID 8000000c:00 = 00000000 00000000 00000000 00000000 | ................
CPUID 8000000d:00 = 00000000 00000000 00000000 00000000 | ................
CPUID 8000000e:00 = 00000000 00000000 00000000 00000000 | ................
CPUID 8000000f:00 = 00000000 00000000 00000000 00000000 | ................
CPUID 80000010:00 = 00000000 00000000 00000000 00000000 | ................
CPUID 80000011:00 = 00000000 00000000 00000000 00000000 | ................
CPUID 80000012:00 = 00000000 00000000 00000000 00000000 | ................
CPUID 80000013:00 = 00000000 00000000 00000000 00000000 | ................
CPUID 80000014:00 = 00000000 00000000 00000000 00000000 | ................
CPUID 80000015:00 = 00000000 00000000 00000000 00000000 | ................
CPUID 80000016:00 = 00000000 00000000 00000000 00000000 | ................
CPUID 80000017:00 = 00000000 00000000 00000000 00000000 | ................
CPUID 80000018:00 = 00000000 00000000 00000000 00000000 | ................
CPUID 80000019:00 = 00000000 00000000 00000000 00000000 | ................
CPUID 8000001a:00 = 00000003 00000000 00000000 00000000 | ................
CPUID 8000001b:00 = 000000ff 00000000 00000000 00000000 | ................
CPUID 8000001c:00 = 00000000 00000000 00000000 00000000 | ................
CPUID 8000001d:00 = 00000121 01c0003f 0000003f 00000000 | !...?...?.......
CPUID 8000001d:01 = 00000122 0040003f 000000ff 00000000 | "...?.@.........
CPUID 8000001d:02 = 0000c143 03c0003f 000007ff 00000002 | C...?...........
CPUID 8000001e:00 = 00000002 00000002 00000000 00000000 | ................
CPUID 80860000:00 = 00000000 00000000 00000000 00000000 | ................
CPUID c0000000:00 = 00000000 00000000 00000000 00000000 | ................
CPU 3:
CPUID 00000000:00 = 0000000d 68747541 444d4163 69746e65 | ....AuthcAMDenti
CPUID 00000001:00 = 00700f01 03040800 3ed8220b 178bfbff | ..p......".>....
CPUID 00000002:00 = 00000000 00000000 00000000 00000000 | ................
CPUID 00000003:00 = 00000000 00000000 00000000 00000000 | ................
CPUID 00000004:00 = 00000000 00000000 00000000 00000000 | ................
CPUID 00000005:00 = 00000040 00000040 00000003 00000000 | @...@...........
CPUID 00000006:00 = 00000000 00000000 00000001 00000000 | ................
CPUID 00000007:00 = 00000000 00000008 00000000 00000000 | ................
CPUID 00000008:00 = 00000000 00000000 00000000 00000000 | ................
CPUID 00000009:00 = 00000000 00000000 00000000 00000000 | ................
CPUID 0000000a:00 = 00000000 00000000 00000000 00000000 | ................
CPUID 0000000b:00 = 00000000 00000000 00000000 00000000 | ................
CPUID 0000000c:00 = 00000000 00000000 00000000 00000000 | ................
CPUID 0000000d:00 = 00000007 00000340 00000340 00000000 | ....@...@.......
CPUID 0000000d:01 = 00000001 00000000 00000000 00000000 | ................
CPUID 0000000d:02 = 00000100 00000240 00000000 00000000 | ....@...........
CPUID 40000000:00 = 00000000 00000000 00000000 00000000 | ................
CPUID 80000000:00 = 8000001e 68747541 444d4163 69746e65 | ....AuthcAMDenti
CPUID 80000001:00 = 00700f01 10000000 154037ff 2fd3fbff | ..p......7@..../
CPUID 80000002:00 = 20444d41 6c687441 74286e6f 3520296d | AMD Athlon(tm) 5
CPUID 80000003:00 = 20303533 20555041 68746977 64615220 | 350 APU with Rad
CPUID 80000004:00 = 286e6f65 20296d74 20203352 00202020 | eon(tm) R3     .
CPUID 80000005:00 = ff08ff08 ff28ff20 20080140 20020140 | .... .(.@.. @.. 
CPUID 80000006:00 = 21000000 42004200 08008140 00000000 | ...!.B.B@.......
CPUID 80000007:00 = 0d6b0101 00000001 00000000 000009d9 | ..k.............
CPUID 80000008:00 = 00003028 00000000 00003003 00000000 | (0.......0......
CPUID 80000009:00 = 00000000 00000000 00000000 00000000 | ................
CPUID 8000000a:00 = 00000001 00000008 00000000 00001cdf | ................
CPUID 8000000b:00 = 00000000 00000000 00000000 00000000 | ................
CPUID 8000000c:00 = 00000000 00000000 00000000 00000000 | ................
CPUID 8000000d:00 = 00000000 00000000 00000000 00000000 | ................
CPUID 8000000e:00 = 00000000 00000000 00000000 00000000 | ................
CPUID 8000000f:00 = 00000000 00000000 00000000 00000000 | ................
CPUID 80000010:00 = 00000000 00000000 00000000 00000000 | ................
CPUID 80000011:00 = 00000000 00000000 00000000 00000000 | ................
CPUID 80000012:00 = 00000000 00000000 00000000 00000000 | ................
CPUID 80000013:00 = 00000000 00000000 00000000 00000000 | ................
CPUID 80000014:00 = 00000000 00000000 00000000 00000000 | ................
CPUID 80000015:00 = 00000000 00000000 00000000 00000000 | ................
CPUID 80000016:00 = 00000000 00000000 00000000 00000000 | ................
CPUID 80000017:00 = 00000000 00000000 00000000 00000000 | ................
CPUID 80000018:00 = 00000000 00000000 00000000 00000000 | ................
CPUID 80000019:00 = 00000000 00000000 00000000 00000000 | ................
CPUID 8000001a:00 = 00000003 00000000 00000000 00000000 | ................
CPUID 8000001b:00 = 000000ff 00000000 00000000 00000000 | ................
CPUID 8000001c:00 = 00000000 00000000 00000000 00000000 | ................
CPUID 8000001d:00 = 00000121 01c0003f 0000003f 00000000 | !...?...?.......
CPUID 8000001d:01 = 00000122 0040003f 000000ff 00000000 | "...?.@.........
CPUID 8000001d:02 = 0000c143 03c0003f 000007ff 00000002 | C...?...........
CPUID 8000001e:00 = 00000003 00000003 00000000 00000000 | ................
CPUID 80860000:00 = 00000000 00000000 00000000 00000000 | ................
CPUID c0000000:00 = 00000000 00000000 00000000 00000000 | ................
