CPU 0:
CPUID 00000000:00 = 00000001 68747541 444d4163 69746e65 | ....AuthcAMDenti
CPUID 00000001:00 = 00200f31 00020800 00002001 178bfbff | 1. ...... ......
CPUID 40000000:00 = 00000000 00000000 00000000 00000000 | ................
CPUID 80000000:00 = 8000001a 68747541 444d4163 69746e65 | ....AuthcAMDenti
CPUID 80000001:00 = 00200f31 20000520 0000131f ebd3fbff | 1. . .. ........
CPUID 80000002:00 = 20444d41 69727554 74286e6f 5820296d | AMD Turion(tm) X
CPUID 80000003:00 = 6c552032 20617274 6c617544 726f432d | 2 Ultra Dual-Cor
CPUID 80000004:00 = 6f4d2065 656c6962 2d4d5a20 00003238 | e Mobile ZM-82..
CPUID 80000005:00 = ff08ff08 ff20ff20 40020140 40020140 | .... . .@..@@..@
CPUID 80000006:00 = 00000000 42004200 04008140 00000000 | .....B.B@.......
CPUID 80000007:00 = 00000000 00000000 00000000 000001f9 | ................
CPUID 80000008:00 = 00003028 00000000 00001001 00000000 | (0..............
CPUID 80000009:00 = 00000000 00000000 00000000 00000000 | ................
CPUID 8000000a:00 = 00000001 00000040 00000000 0000000e | ....@...........
CPUID 8000000b:00 = 00000000 00000000 00000000 00000000 | ................
CPUID 8000000c:00 = 00000000 00000000 00000000 00000000 | ................
CPUID 8000000d:00 = 00000000 00000000 00000000 00000000 | ................
CPUID 8000000e:00 = 00000000 00000000 00000000 00000000 | ................
CPUID 8000000f:00 = 00000000 00000000 00000000 00000000 | ................
CPUID 80000010:00 = 00000000 00000000 00000000 00000000 | ................
CPUID 80000011:00 = 00000000 00000000 00000000 00000000 | ................
CPUID 80000012:00 = 00000000 00000000 00000000 00000000 | ................
CPUID 80000013:00 = 00000000 00000000 00000000 00000000 | ................
CPUID 80000014:00 = 00000000 00000000 00000000 00000000 | ................
CPUID 80000015:00 = 00000000 00000000 00000000 00000000 | ................
CPUID 80000016:00 = 00000000 00000000 00000000 00000000 | ................
CPUID 80000017:00 = 00000000 00000000 00000000 00000000 | ................
CPUID 80000018:00 = 00000000 00000000 00000000 00000000 | ................
CPUID 80000019:00 = 00000000 00000000 00000000 00000000 | ................
CPUID 8000001a:00 = 00000000 00000000 00000000 00000000 | ................
CPUID 80860000:00 = 00000000 00000000 00000000 00000000 | ................
CPUID c0000000:00 = 00000000 00000000 00000000 00000000 | ................
