CPU 0:
CPUID 00000000:00 = 00000002 69727943 64616574 736e4978 | ....CyriteadxIns
CPUID 00000001:00 = 00000540 00000000 00000000 00808131 | @...........1...
CPUID 00000002:00 = 00007001 00000000 00000000 00000080 | .p..............
CPUID 40000000:00 = 00000000 00000000 00000000 00000000 | ................
CPUID 80000000:00 = 80000005 00000000 00000000 00000000 | ................
CPUID 80000001:00 = 00000540 00000000 00000000 01818131 | @...........1...
CPUID 80000002:00 = 69727943 654d2078 47616964 206d7458 | Cyrix MediaGXtm 
CPUID 80000003:00 = 74584d4d 6e45206d 636e6168 00006465 | MMXtm Enhanced..
CPUID 80000004:00 = 00000000 00000000 00000000 00000000 | ................
CPUID 80000005:00 = 00000000 00007001 00000080 00000000 | .....p..........
CPUID 80860000:00 = 00000000 00000000 00000000 00000000 | ................
CPUID c0000000:00 = 00000000 00000000 00000000 00000000 | ................
