CPU 0:
CPUID 00000000:00 = 00000003 756e6547 3638784d 54656e69 | ....GenuMx86ineT
CPUID 00000001:00 = 00000543 00000000 00000000 0084893f | C...........?...
CPUID 00000002:00 = 00000000 00000000 00000000 00000000 | ................
CPUID 00000003:00 = 00000000 229b3189 0061a48b 000068d6 | .....1."..a..h..
CPUID 40000000:00 = 00000000 00000000 00000000 00000000 | ................
CPUID 80000000:00 = 80000006 6e617254 55504361 74656d73 | ....TranaCPUsmet
CPUID 80000001:00 = 00000543 00000000 00000000 0081813f | C...........?...
CPUID 80000002:00 = 6e617254 74656d73 6d742861 72432029 | Transmeta(tm) Cr
CPUID 80000003:00 = 656f7375 296d7428 6f725020 73736563 | usoe(tm) Process
CPUID 80000004:00 = 5420726f 3038354d 00000030 00000000 | or TM5800.......
CPUID 80000005:00 = 00000000 04ff04ff 40100120 40080140 | ........ ..@@..@
CPUID 80000006:00 = 00000000 00000000 02004180 00000000 | .........A......
CPUID 80860000:00 = 80860007 6e617254 55504361 74656d73 | ....TranaCPUsmet
CPUID 80860001:00 = 00000543 01050002 000003e8 000001ce | C...............
CPUID 80860002:00 = 00000000 0404030a 000000b8 00000000 | ................
CPUID 80860003:00 = 33303032 38313630 3a353120 6f203732 | 20030618 15:27 o
CPUID 80860004:00 = 63696666 206c6169 656c6572 20657361 | fficial release 
CPUID 80860005:00 = 2e342e34 00312333 00000000 00000000 | 4.4.3#1.........
CPUID 80860006:00 = 00000000 00000000 00000000 00000000 | ................
CPUID 80860007:00 = 000003e8 00000578 00000064 000048cb | ....x...d....H..
CPUID c0000000:00 = 00000000 00000000 00000000 00000000 | ................
