CPU 0:
CPUID 00000000:00 = 00000003 756e6547 3638784d 54656e69 | ....GenuMx86ineT
CPUID 00000001:00 = 00000f24 00011000 00000000 2fcff9ff | $............../
CPUID 00000002:00 = 00000001 00000000 00000000 00000000 | ................
CPUID 00000003:00 = 0000000c 24c01189 2000030f 015b380a | .......$... .8[.
CPUID 40000000:00 = 00000000 00000000 00000000 00000000 | ................
CPUID 80000000:00 = 80000008 6e617254 55504361 74656d73 | ....TranaCPUsmet
CPUID 80000001:00 = 00000f24 00000000 00000000 01c3f1ff | $...............
CPUID 80000002:00 = 6e617254 74656d73 66452061 65636966 | Transmeta Effice
CPUID 80000003:00 = 74286e6f 5020296d 65636f72 726f7373 | on(tm) Processor
CPUID 80000004:00 = 384d5420 00303030 00000000 00000000 |  TM8000.........
CPUID 80000005:00 = 00000000 04ff04ff 40080120 80040140 | ........ ..@@...
CPUID 80000006:00 = 00000000 00000000 04004180 00000000 | .........A......
CPUID 80000007:00 = 00000000 00000000 00000000 00000000 | ................
CPUID 80000008:00 = 00002020 00000000 00000000 00000000 |   ..............
CPUID 80860000:00 = 80860007 6e617254 55504361 74656d73 | ....TranaCPUsmet
CPUID 80860001:00 = 00000f24 02000000 000003e8 0000142a | $...........*...
CPUID 80860002:00 = 24c01101 06000401 0000003e 00000000 | ...$....>.......
CPUID 80860003:00 = 34303032 33323730 3a303220 6f203134 | 20040723 20:41 o
CPUID 80860004:00 = 63696666 206c6169 656c6572 20657361 | fficial release 
CPUID 80860005:00 = 2e302e36 00362334 00000000 00000000 | 6.0.4#6.........
CPUID 80860006:00 = 00000000 00000000 00000000 00000000 | ................
CPUID 80860007:00 = 000003e8 00000578 00000064 00000000 | ....x...d.......
CPUID c0000000:00 = 00000000 00000000 00000000 00000000 | ................
