CPU 0:
CPUID 00000000:00 = 00000006 756e6547 6c65746e 49656e69 | ....GenuntelineI
CPUID 00000001:00 = 00000f65 00010800 0000e41d bfebfbff | e...............
CPUID 00000002:00 = 605b5101 00000000 00000000 007b7040 | .Q[`........@p{.
CPUID 00000003:00 = 00000000 00000000 00000000 00000000 | ................
CPUID 00000004:00 = 00000121 01c0003f 0000001f 00000000 | !...?...........
CPUID 00000004:01 = 00000143 01c0103f 000001ff 00000000 | C...?...........
CPUID 00000004:02 = 00000000 00000000 00000000 00000000 | ................
CPUID 00000005:00 = 00000040 00000040 00000000 00000000 | @...@...........
CPUID 00000006:00 = 00000000 00000000 00000000 00000000 | ................
CPUID 40000000:00 = 00000000 00000000 00000000 00000000 | ................
CPUID 80000000:00 = 80000008 00000000 00000000 00000000 | ................
CPUID 80000001:00 = 00000000 00000000 00000001 20100000 | ............... 
CPUID 80000002:00 = 20202020 20202020 20202020 6e492020 |               In
CPUID 80000003:00 = 286c6574 43202952 72656c65 52286e6f | tel(R) Celeron(R
CPUID 80000004:00 = 20442029 20555043 36302e33 007a4847 | ) D CPU 3.06GHz.
CPUID 80000005:00 = 00000000 00000000 00000000 00000000 | ................
CPUID 80000006:00 = 00000000 00000000 02006040 00000000 | ........@`......
CPUID 80000007:00 = 00000000 00000000 00000000 00000000 | ................
CPUID 80000008:00 = 00003024 00000000 00000000 00000000 | $0..............
CPUID 80860000:00 = 00000000 00000000 00000000 00000000 | ................
CPUID c0000000:00 = 00000000 00000000 00000000 00000000 | ................
