CPU 0:
CPUID 00000000:00 = 00000001 756e6547 6c65746e 49656e69 | ....GenuntelineI
CPUID 00000001:00 = 00000543 00000000 00000000 008003bf | C...............
CPUID 40000000:00 = 00000000 00000000 00000000 00000000 | ................
CPUID 80000000:00 = 00000000 00000000 00000000 00000000 | ................
CPUID 80860000:00 = 00000000 00000000 00000000 00000000 | ................
CPUID c0000000:00 = 00000000 00000000 00000000 00000000 | ................
CPU 1:
CPUID 00000000:00 = 00000001 756e6547 6c65746e 49656e69 | ....GenuntelineI
CPUID 00000001:00 = 00002544 00000000 00000000 008003bf | D%..............
CPUID 40000000:00 = 00000000 00000000 00000000 00000000 | ................
CPUID 80000000:00 = 00000000 00000000 00000000 00000000 | ................
CPUID 80860000:00 = 00000000 00000000 00000000 00000000 | ................
CPUID c0000000:00 = 00000000 00000000 00000000 00000000 | ................
