CPU 0:
CPUID 00000000:00 = 0000000d 756e6547 6c65746e 49656e69 | ....GenuntelineI
CPUID 00000001:00 = 000206a2 00100800 1fbaebff bfebfbff | ................
CPUID 00000002:00 = 55035a01 00f0b2ff 00000000 00ca0000 | .Z.U............
CPUID 00000003:00 = 00000000 00000000 00000000 00000000 | ................
CPUID 00000004:00 = 1c004121 01c0003f 0000003f 00000000 | !A..?...?.......
CPUID 00000004:01 = 1c004122 01c0003f 0000003f 00000000 | "A..?...?.......
CPUID 00000004:02 = 1c004143 01c0003f 000001ff 00000000 | CA..?...........
CPUID 00000004:03 = 1c03c163 03c0003f 00000fff 00000002 | c...?...........
CPUID 00000004:04 = 00000000 00000000 00000000 00000000 | ................
CPUID 00000005:00 = 00000040 00000040 00000003 00021120 | @...@....... ...
CPUID 00000006:00 = 00000077 00000002 00000001 00000000 | w...............
CPUID 00000007:00 = 00000000 00000000 00000000 00000000 | ................
CPUID 00000008:00 = 00000000 00000000 00000000 00000000 | ................
CPUID 00000009:00 = 00000000 00000000 00000000 00000000 | ................
CPUID 0000000a:00 = 07300403 00000000 00000000 00000603 | ..0.............
CPUID 0000000b:00 = 00000001 00000002 00000100 00000000 | ................
CPUID 0000000b:01 = 00000004 00000004 00000201 00000000 | ................
CPUID 0000000c:00 = 00000000 00000000 00000000 00000000 | ................
CPUID 40000000:00 = 00000000 00000000 00000000 00000000 | ................
CPUID 80000000:00 = 80000008 00000000 00000000 00000000 | ................
CPUID 80000001:00 = 00000000 00000000 00000001 28100800 | ...............(
CPUID 80000002:00 = 756e6547 20656e69 65746e49 2952286c | Genuine Intel(R)
CPUID 80000003:00 = 55504320 20202020 20202020 20202020 |  CPU            
CPUID 80000004:00 = 20202030 20402020 30362e31 007a4847 | 0     @ 1.60GHz.
CPUID 80000005:00 = 00000000 00000000 00000000 00000000 | ................
CPUID 80000006:00 = 00000000 00000000 01006040 00000000 | ........@`......
CPUID 80000007:00 = 00000000 00000000 00000000 00000100 | ................
CPUID 80000008:00 = 00003024 00000000 00000000 00000000 | $0..............
CPUID 80860000:00 = 00000000 00000000 00000000 00000000 | ................
CPUID c0000000:00 = 00000000 00000000 00000000 00000000 | ................
