CPU 0:
CPUID 00000000:00 = 00000016 756e6547 6c65746e 49656e69 | ....GenuntelineI
CPUID 00000001:00 = 000a0654 00200800 fefaf387 bfebfbff | T..... .........
CPUID 00000002:00 = 76036301 00f0b5ff 00000000 00c30000 | .c.v............
CPUID 00000003:00 = 00000000 00000000 00000000 00000000 | ................
CPUID 00000004:00 = 3c004121 01c0003f 0000003f 00000000 | !A.<?...?.......
CPUID 00000004:01 = 3c004122 01c0003f 0000003f 00000000 | "A.<?...?.......
CPUID 00000004:02 = 3c004143 00c0003f 000003ff 00000000 | CA.<?...........
CPUID 00000004:03 = 3c07c163 03c0003f 00004fff 00000002 | c..<?....O......
CPUID 00000004:04 = 00000000 00000000 00000000 00000000 | ................
CPUID 00000005:00 = 00000000 00000000 00000000 00000000 | ................
CPUID 00000006:00 = 000007f1 00000002 00000009 00000000 | ................
CPUID 00000007:00 = 00000000 009c67ab 00000000 bc000400 | .....g..........
CPUID 00000008:00 = 00000000 00000000 00000000 00000000 | ................
CPUID 00000009:00 = 00000000 00000000 00000000 00000000 | ................
CPUID 0000000a:00 = 07300404 00000000 00000000 00000603 | ..0.............
CPUID 0000000b:00 = 00000001 00000002 00000100 00000000 | ................
CPUID 0000000b:01 = 00000005 00000014 00000201 00000000 | ................
CPUID 0000000c:00 = 00000000 00000000 00000000 00000000 | ................
CPUID 0000000d:00 = 0000001f 00000440 00000440 00000000 | ....@...@.......
CPUID 0000000d:01 = 0000000f 000003c0 00000000 00000000 | ................
CPUID 0000000d:02 = 00000100 00000240 00000000 00000000 | ....@...........
CPUID 0000000d:03 = 00000040 000003c0 00000000 00000000 | @...............
CPUID 0000000e:00 = 00000000 00000000 00000000 00000000 | ................
CPUID 0000000f:00 = 00000000 00000000 00000000 00000000 | ................
CPUID 00000010:00 = 00000000 00000000 00000000 00000000 | ................
CPUID 00000011:00 = 00000000 00000000 00000000 00000000 | ................
CPUID 00000012:00 = 00000000 00000000 00000000 00000000 | ................
CPUID 00000013:00 = 00000000 00000000 00000000 00000000 | ................
CPUID 00000014:00 = 00000001 0000000f 00000003 00000000 | ................
CPUID 00000014:01 = 02490002 003f3fff 00000000 00000000 | ..I..??.........
CPUID 00000015:00 = 00000002 00000134 00000000 00000000 | ....4...........
CPUID 00000016:00 = 00000000 00000000 00000000 00000000 | ................
CPUID 40000000:00 = 4000000b 7263694d 666f736f 76482074 | ...@Microsoft Hv
CPUID 40000001:00 = 31237648 00000000 00000000 00000000 | Hv#1............
CPUID 40000002:00 = 000047ba 000a0000 00000001 00000473 | .G..........s...
CPUID 40000003:00 = 00003fff 002bb9ff 00000002 19fffbf6 | .?....+.........
CPUID 40000004:00 = 00060e14 00000000 0000002e 00000000 | ................
CPUID 40000005:00 = 00000140 00000200 00000fb4 00000000 | @...............
CPUID 40000006:00 = 000200af 00000000 00000000 00000000 | ................
CPUID 40000007:00 = 80000007 00000003 00000000 00000000 | ................
CPUID 40000008:00 = 00000000 00000000 00000000 00000000 | ................
CPUID 40000009:00 = 00000000 00000000 00000000 00000000 | ................
CPUID 4000000a:00 = 00000000 00000000 00000000 00000000 | ................
CPUID 4000000b:00 = 001ff002 00000000 00000000 00000000 | ................
CPUID 80000000:00 = 80000008 00000000 00000000 00000000 | ................
CPUID 80000001:00 = 00000000 00000000 00000121 2c100800 | ........!......,
CPUID 80000002:00 = 65746e49 2952286c 6f655820 2952286e | Intel(R) Xeon(R)
CPUID 80000003:00 = 312d5720 50303932 55504320 33204020 |  W-1290P CPU @ 3
CPUID 80000004:00 = 4730372e 00007a48 00000000 00000000 | .70GHz..........
CPUID 80000005:00 = 00000000 00000000 00000000 00000000 | ................
CPUID 80000006:00 = 00000000 00000000 01006040 00000000 | ........@`......
CPUID 80000007:00 = 00000000 00000000 00000000 00000100 | ................
CPUID 80000008:00 = 00003027 00000000 00000000 00000000 | '0..............
CPUID 80860000:00 = 00000000 00000000 00000000 00000000 | ................
CPUID c0000000:00 = 00000000 00000000 00000000 00000000 | ................
