CPU 0:
CPUID 00000000:00 = 0000000a 756e6547 6c65746e 49656e69 | ....GenuntelineI
CPUID 00000001:00 = 00020661 00020800 0040c39d bfe9fbff | a.........@.....
CPUID 00000002:00 = 4fba5901 0e3080c0 00000000 00000000 | .Y.O..0.........
CPUID 00000003:00 = 00000000 00000000 00000000 00000000 | ................
CPUID 00000004:00 = 00004121 0140003f 0000003f 00000001 | !A..?.@.?.......
CPUID 00000004:01 = 00004122 01c0003f 0000003f 00000001 | "A..?...?.......
CPUID 00000004:02 = 00004143 01c0003f 000003ff 00000001 | CA..?...........
CPUID 00000004:03 = 00000000 00000000 00000000 00000000 | ................
CPUID 00000005:00 = 00000040 00000040 00000003 03020220 | @...@....... ...
CPUID 00000006:00 = 00000001 00000002 00000001 00000000 | ................
CPUID 00000007:00 = 00000000 00000000 00000000 00000000 | ................
CPUID 00000008:00 = 00000000 00000000 00000000 00000000 | ................
CPUID 00000009:00 = 00000000 00000000 00000000 00000000 | ................
CPUID 0000000a:00 = 07280203 00000000 00000000 00000503 | ..(.............
CPUID 40000000:00 = 00000000 00000000 00000000 00000000 | ................
CPUID 80000000:00 = 80000008 00000000 00000000 00000000 | ................
CPUID 80000001:00 = 00000000 00000000 00000001 00100000 | ................
CPUID 80000002:00 = 20202020 20202020 746e4920 52286c65 |          Intel(R
CPUID 80000003:00 = 74412029 54286d6f 4320294d 5a205550 | ) Atom(TM) CPU Z
CPUID 80000004:00 = 20303736 20402020 30352e31 007a4847 | 670   @ 1.50GHz.
CPUID 80000005:00 = 00000000 00000000 00000000 00000000 | ................
CPUID 80000006:00 = 00000000 00000000 02006040 00000000 | ........@`......
CPUID 80000007:00 = 00000000 00000000 00000000 00000000 | ................
CPUID 80000008:00 = 00002020 00000000 00000000 00000000 |   ..............
CPUID 80860000:00 = 00000000 00000000 00000000 00000000 | ................
CPUID c0000000:00 = 00000000 00000000 00000000 00000000 | ................
CPU 1:
CPUID 00000000:00 = 0000000a 756e6547 6c65746e 49656e69 | ....GenuntelineI
CPUID 00000001:00 = 00020661 01020800 0040c39d bfe9fbff | a.........@.....
CPUID 00000002:00 = 4fba5901 0e3080c0 00000000 00000000 | .Y.O..0.........
CPUID 00000003:00 = 00000000 00000000 00000000 00000000 | ................
CPUID 00000004:00 = 00004121 0140003f 0000003f 00000001 | !A..?.@.?.......
CPUID 00000004:01 = 00004122 01c0003f 0000003f 00000001 | "A..?...?.......
CPUID 00000004:02 = 00004143 01c0003f 000003ff 00000001 | CA..?...........
CPUID 00000004:03 = 00000000 00000000 00000000 00000000 | ................
CPUID 00000005:00 = 00000040 00000040 00000003 03020220 | @...@....... ...
CPUID 00000006:00 = 00000001 00000002 00000001 00000000 | ................
CPUID 00000007:00 = 00000000 00000000 00000000 00000000 | ................
CPUID 00000008:00 = 00000000 00000000 00000000 00000000 | ................
CPUID 00000009:00 = 00000000 00000000 00000000 00000000 | ................
CPUID 0000000a:00 = 07280203 00000000 00000000 00000503 | ..(.............
CPUID 40000000:00 = 00000000 00000000 00000000 00000000 | ................
CPUID 80000000:00 = 80000008 00000000 00000000 00000000 | ................
CPUID 80000001:00 = 00000000 00000000 00000001 00100000 | ................
CPUID 80000002:00 = 20202020 20202020 746e4920 52286c65 |          Intel(R
CPUID 80000003:00 = 74412029 54286d6f 4320294d 5a205550 | ) Atom(TM) CPU Z
CPUID 80000004:00 = 20303736 20402020 30352e31 007a4847 | 670   @ 1.50GHz.
CPUID 80000005:00 = 00000000 00000000 00000000 00000000 | ................
CPUID 80000006:00 = 00000000 00000000 02006040 00000000 | ........@`......
CPUID 80000007:00 = 00000000 00000000 00000000 00000000 | ................
CPUID 80000008:00 = 00002020 00000000 00000000 00000000 |   ..............
CPUID 80860000:00 = 00000000 00000000 00000000 00000000 | ................
CPUID c0000000:00 = 00000000 00000000 00000000 00000000 | ................
