CPU 0:
CPUID 00000000:00 = 0000000d 756e6547 6c65746e 49656e69 | ....GenuntelineI
CPUID 00000001:00 = 000306e4 00200800 7fbee3ff bfebfbff | ...... .........
CPUID 00000002:00 = 76035a01 00f0b2ff 00000000 00ca0000 | .Z.v............
CPUID 00000003:00 = 00000000 00000000 00000000 00000000 | ................
CPUID 00000004:00 = 3c004121 01c0003f 0000003f 00000000 | !A.<?...?.......
CPUID 00000004:01 = 3c004122 01c0003f 0000003f 00000000 | "A.<?...?.......
CPUID 00000004:02 = 3c004143 01c0003f 000001ff 00000000 | CA.<?...........
CPUID 00000004:03 = 3c07c163 04c0003f 00005fff 00000006 | c..<?...._......
CPUID 00000004:04 = 00000000 00000000 00000000 00000000 | ................
CPUID 00000005:00 = 00000040 00000040 00000003 00001120 | @...@....... ...
CPUID 00000006:00 = 00000077 00000002 00000009 00000000 | w...............
CPUID 00000007:00 = 00000000 00000281 00000000 00000000 | ................
CPUID 00000008:00 = 00000000 00000000 00000000 00000000 | ................
CPUID 00000009:00 = 00000001 00000000 00000000 00000000 | ................
CPUID 0000000a:00 = 07300403 00000000 00000000 00000603 | ..0.............
CPUID 0000000b:00 = 00000001 00000002 00000100 00000000 | ................
CPUID 0000000b:01 = 00000005 00000018 00000201 00000000 | ................
CPUID 0000000c:00 = 00000000 00000000 00000000 00000000 | ................
CPUID 0000000d:00 = 00000007 00000340 00000340 00000000 | ....@...@.......
CPUID 0000000d:01 = 00000100 00000240 00000000 00000000 | ....@...........
CPUID 40000000:00 = 00000000 00000000 00000000 00000000 | ................
CPUID 80000000:00 = 80000008 00000000 00000000 00000000 | ................
CPUID 80000001:00 = 00000000 00000000 00000001 2c100000 | ...............,
CPUID 80000002:00 = 20202020 6e492020 286c6574 58202952 |       Intel(R) X
CPUID 80000003:00 = 286e6f65 43202952 45205550 36322d35 | eon(R) CPU E5-26
CPUID 80000004:00 = 76203739 20402032 30372e32 007a4847 | 97 v2 @ 2.70GHz.
CPUID 80000005:00 = 00000000 00000000 00000000 00000000 | ................
CPUID 80000006:00 = 00000000 00000000 01006040 00000000 | ........@`......
CPUID 80000007:00 = 00000000 00000000 00000000 00000100 | ................
CPUID 80000008:00 = 0000302e 00000000 00000000 00000000 | .0..............
CPUID 80860000:00 = 00000000 00000000 00000000 00000000 | ................
CPUID c0000000:00 = 00000000 00000000 00000000 00000000 | ................
