CPU 0:
CPUID 00000000:00 = 0000000b 756e6547 6c65746e 49656e69 | ....GenuntelineI
CPUID 00000001:00 = 000206e5 22200800 00bce3bd bfebfbff | ...... "........
CPUID 00000002:00 = 55035a01 00f0b2eb 00000000 09ca212c | .Z.U........,!..
CPUID 00000003:00 = 00000000 00000000 00000000 00000000 | ................
CPUID 00000004:00 = 3c004121 01c0003f 0000003f 00000000 | !A.<?...?.......
CPUID 00000004:01 = 3c004122 00c0003f 0000007f 00000000 | "A.<?...........
CPUID 00000004:02 = 3c004143 01c0003f 000001ff 00000000 | CA.<?...........
CPUID 00000004:03 = 3c07c163 05c0003f 00002fff 00000002 | c..<?..../......
CPUID 00000004:04 = 00000000 00000000 00000000 00000000 | ................
CPUID 00000005:00 = 00000040 00000040 00000003 00000120 | @...@....... ...
CPUID 00000006:00 = 00000001 00000001 00000001 00000000 | ................
CPUID 00000007:00 = 00000000 00000000 00000000 00000000 | ................
CPUID 00000008:00 = 00000000 00000000 00000000 00000000 | ................
CPUID 00000009:00 = 00000001 00000000 00000000 00000000 | ................
CPUID 0000000a:00 = 07300403 00000044 00000000 00000603 | ..0.D...........
CPUID 0000000b:00 = 00000001 00000002 00000100 00000022 | ............"...
CPUID 0000000b:01 = 00000005 00000008 00000201 00000022 | ............"...
CPUID 40000000:00 = 00000000 00000000 00000000 00000000 | ................
CPUID 80000000:00 = 80000008 00000000 00000000 00000000 | ................
CPUID 80000001:00 = 00000000 00000000 00000001 28100800 | ...............(
CPUID 80000002:00 = 65746e49 2952286c 6f655820 2952286e | Intel(R) Xeon(R)
CPUID 80000003:00 = 55504320 20202020 20202020 45202020 |  CPU           E
CPUID 80000004:00 = 30323537 20402020 37382e31 007a4847 | 7520  @ 1.87GHz.
CPUID 80000005:00 = 00000000 00000000 00000000 00000000 | ................
CPUID 80000006:00 = 00000000 00000000 01006040 00000000 | ........@`......
CPUID 80000007:00 = 00000000 00000000 00000000 00000100 | ................
CPUID 80000008:00 = 0000302c 00000000 00000000 00000000 | ,0..............
CPUID 80860000:00 = 00000000 00000000 00000000 00000000 | ................
CPUID c0000000:00 = 00000000 00000000 00000000 00000000 | ................
