CPU 0:
CPUID 00000000:00 = 0000000a 756e6547 6c65746e 49656e69 | ....GenuntelineI
CPUID 00000001:00 = 000006f4 00020800 0004e3bd bfebfbff | ................
CPUID 00000002:00 = 05b0b101 005657f0 00000000 2cb43049 | .....WV.....I0.,
CPUID 00000003:00 = 00000000 00000000 00000000 00000000 | ................
CPUID 00000004:00 = 04000121 01c0003f 0000003f 00000001 | !...?...?.......
CPUID 00000004:01 = 04000122 01c0003f 0000003f 00000001 | "...?...?.......
CPUID 00000004:02 = 04004143 03c0003f 00000fff 00000001 | CA..?...........
CPUID 00000004:03 = 00000000 00000000 00000000 00000000 | ................
CPUID 00000005:00 = 00000040 00000040 00000003 00000020 | @...@....... ...
CPUID 00000006:00 = 00000001 00000002 00000001 00000000 | ................
CPUID 00000007:00 = 00000000 00000000 00000000 00000000 | ................
CPUID 00000008:00 = 00000400 00000000 00000000 00000000 | ................
CPUID 00000009:00 = 00000000 00000000 00000000 00000000 | ................
CPUID 0000000a:00 = 07280202 00000000 00000000 00000000 | ..(.............
CPUID 40000000:00 = 00000000 00000000 00000000 00000000 | ................
CPUID 80000000:00 = 80000008 00000000 00000000 00000000 | ................
CPUID 80000001:00 = 00000000 00000000 00000001 20100000 | ............... 
CPUID 80000002:00 = 756e6547 20656e69 65746e49 2952286c | Genuine Intel(R)
CPUID 80000003:00 = 55504320 20202020 20202020 20202020 |  CPU            
CPUID 80000004:00 = 20202020 20402020 33332e32 007a4847 |       @ 2.33GHz.
CPUID 80000005:00 = 00000000 00000000 00000000 00000000 | ................
CPUID 80000006:00 = 00000000 00000000 10008040 00000000 | ........@.......
CPUID 80000007:00 = 00000000 00000000 00000000 00000000 | ................
CPUID 80000008:00 = 00003024 00000000 00000000 00000000 | $0..............
CPUID 80860000:00 = 00000000 00000000 00000000 00000000 | ................
CPUID c0000000:00 = 00000000 00000000 00000000 00000000 | ................
CPU 1:
CPUID 00000000:00 = 0000000a 756e6547 6c65746e 49656e69 | ....GenuntelineI
CPUID 00000001:00 = 000006f4 06020800 0004e3bd bfebfbff | ................
CPUID 00000002:00 = 05b0b101 005657f0 00000000 2cb43049 | .....WV.....I0.,
CPUID 00000003:00 = 00000000 00000000 00000000 00000000 | ................
CPUID 00000004:00 = 04000121 01c0003f 0000003f 00000001 | !...?...?.......
CPUID 00000004:01 = 04000122 01c0003f 0000003f 00000001 | "...?...?.......
CPUID 00000004:02 = 04004143 03c0003f 00000fff 00000001 | CA..?...........
CPUID 00000004:03 = 00000000 00000000 00000000 00000000 | ................
CPUID 00000005:00 = 00000040 00000040 00000003 00000020 | @...@....... ...
CPUID 00000006:00 = 00000001 00000002 00000001 00000000 | ................
CPUID 00000007:00 = 00000000 00000000 00000000 00000000 | ................
CPUID 00000008:00 = 00000400 00000000 00000000 00000000 | ................
CPUID 00000009:00 = 00000000 00000000 00000000 00000000 | ................
CPUID 0000000a:00 = 07280202 00000000 00000000 00000000 | ..(.............
CPUID 40000000:00 = 00000000 00000000 00000000 00000000 | ................
CPUID 80000000:00 = 80000008 00000000 00000000 00000000 | ................
CPUID 80000001:00 = 00000000 00000000 00000001 20100000 | ............... 
CPUID 80000002:00 = 756e6547 20656e69 65746e49 2952286c | Genuine Intel(R)
CPUID 80000003:00 = 55504320 20202020 20202020 20202020 |  CPU            
CPUID 80000004:00 = 20202020 20402020 33332e32 007a4847 |       @ 2.33GHz.
CPUID 80000005:00 = 00000000 00000000 00000000 00000000 | ................
CPUID 80000006:00 = 00000000 00000000 10008040 00000000 | ........@.......
CPUID 80000007:00 = 00000000 00000000 00000000 00000000 | ................
CPUID 80000008:00 = 00003024 00000000 00000000 00000000 | $0..............
CPUID 80860000:00 = 00000000 00000000 00000000 00000000 | ................
CPUID c0000000:00 = 00000000 00000000 00000000 00000000 | ................
CPU 2:
CPUID 00000000:00 = 0000000a 756e6547 6c65746e 49656e69 | ....GenuntelineI
CPUID 00000001:00 = 000006f4 01020800 0004e3bd bfebfbff | ................
CPUID 00000002:00 = 05b0b101 005657f0 00000000 2cb43049 | .....WV.....I0.,
CPUID 00000003:00 = 00000000 00000000 00000000 00000000 | ................
CPUID 00000004:00 = 04000121 01c0003f 0000003f 00000001 | !...?...?.......
CPUID 00000004:01 = 04000122 01c0003f 0000003f 00000001 | "...?...?.......
CPUID 00000004:02 = 04004143 03c0003f 00000fff 00000001 | CA..?...........
CPUID 00000004:03 = 00000000 00000000 00000000 00000000 | ................
CPUID 00000005:00 = 00000040 00000040 00000003 00000020 | @...@....... ...
CPUID 00000006:00 = 00000001 00000002 00000001 00000000 | ................
CPUID 00000007:00 = 00000000 00000000 00000000 00000000 | ................
CPUID 00000008:00 = 00000400 00000000 00000000 00000000 | ................
CPUID 00000009:00 = 00000000 00000000 00000000 00000000 | ................
CPUID 0000000a:00 = 07280202 00000000 00000000 00000000 | ..(.............
CPUID 40000000:00 = 00000000 00000000 00000000 00000000 | ................
CPUID 80000000:00 = 80000008 00000000 00000000 00000000 | ................
CPUID 80000001:00 = 00000000 00000000 00000001 20100000 | ............... 
CPUID 80000002:00 = 756e6547 20656e69 65746e49 2952286c | Genuine Intel(R)
CPUID 80000003:00 = 55504320 20202020 20202020 20202020 |  CPU            
CPUID 80000004:00 = 20202020 20402020 33332e32 007a4847 |       @ 2.33GHz.
CPUID 80000005:00 = 00000000 00000000 00000000 00000000 | ................
CPUID 80000006:00 = 00000000 00000000 10008040 00000000 | ........@.......
CPUID 80000007:00 = 00000000 00000000 00000000 00000000 | ................
CPUID 80000008:00 = 00003024 00000000 00000000 00000000 | $0..............
CPUID 80860000:00 = 00000000 00000000 00000000 00000000 | ................
CPUID c0000000:00 = 00000000 00000000 00000000 00000000 | ................
CPU 3:
CPUID 00000000:00 = 0000000a 756e6547 6c65746e 49656e69 | ....GenuntelineI
CPUID 00000001:00 = 000006f4 07020800 0004e3bd bfebfbff | ................
CPUID 00000002:00 = 05b0b101 005657f0 00000000 2cb43049 | .....WV.....I0.,
CPUID 00000003:00 = 00000000 00000000 00000000 00000000 | ................
CPUID 00000004:00 = 04000121 01c0003f 0000003f 00000001 | !...?...?.......
CPUID 00000004:01 = 04000122 01c0003f 0000003f 00000001 | "...?...?.......
CPUID 00000004:02 = 04004143 03c0003f 00000fff 00000001 | CA..?...........
CPUID 00000004:03 = 00000000 00000000 00000000 00000000 | ................
CPUID 00000005:00 = 00000040 00000040 00000003 00000020 | @...@....... ...
CPUID 00000006:00 = 00000001 00000002 00000001 00000000 | ................
CPUID 00000007:00 = 00000000 00000000 00000000 00000000 | ................
CPUID 00000008:00 = 00000400 00000000 00000000 00000000 | ................
CPUID 00000009:00 = 00000000 00000000 00000000 00000000 | ................
CPUID 0000000a:00 = 07280202 00000000 00000000 00000000 | ..(.............
CPUID 40000000:00 = 00000000 00000000 00000000 00000000 | ................
CPUID 80000000:00 = 80000008 00000000 00000000 00000000 | ................
CPUID 80000001:00 = 00000000 00000000 00000001 20100000 | ............... 
CPUID 80000002:00 = 756e6547 20656e69 65746e49 2952286c | Genuine Intel(R)
CPUID 80000003:00 = 55504320 20202020 20202020 20202020 |  CPU            
CPUID 80000004:00 = 20202020 20402020 33332e32 007a4847 |       @ 2.33GHz.
CPUID 80000005:00 = 00000000 00000000 00000000 00000000 | ................
CPUID 80000006:00 = 00000000 00000000 10008040 00000000 | ........@.......
CPUID 80000007:00 = 00000000 00000000 00000000 00000000 | ................
CPUID 80000008:00 = 00003024 00000000 00000000 00000000 | $0..............
CPUID 80860000:00 = 00000000 00000000 00000000 00000000 | ................
CPUID c0000000:00 = 00000000 00000000 00000000 00000000 | ................
