CPU 0:
CPUID 00000000:00 = 00000003 756e6547 6c65746e 49656e69 | ....GenuntelineI
CPUID 00000001:00 = 00000673 00000000 00000000 0387fbff | s...............
CPUID 00000002:00 = 03020101 00000000 00000000 0c040844 | ............D...
CPUID 00000003:00 = 00000000 00000000 063f02b2 0003f437 | ..........?.7...
CPUID 40000000:00 = 00000000 00000000 00000000 00000000 | ................
CPUID 80000000:00 = 00000000 00000000 00000000 00000000 | ................
CPUID 80860000:00 = 00000000 00000000 00000000 00000000 | ................
CPUID c0000000:00 = 00000000 00000000 00000000 00000000 | ................
CPU 1:
CPUID 00000000:00 = 00000003 756e6547 6c65746e 49656e69 | ....GenuntelineI
CPUID 00000001:00 = 00000673 00000000 00000000 0387fbff | s...............
CPUID 00000002:00 = 03020101 00000000 00000000 0c040844 | ............D...
CPUID 00000003:00 = 00000000 00000000 acc70366 000151c5 | ........f....Q..
CPUID 40000000:00 = 00000000 00000000 00000000 00000000 | ................
CPUID 80000000:00 = 00000000 00000000 00000000 00000000 | ................
CPUID 80860000:00 = 00000000 00000000 00000000 00000000 | ................
CPUID c0000000:00 = 00000000 00000000 00000000 00000000 | ................
CPU 2:
CPUID 00000000:00 = 00000003 756e6547 6c65746e 49656e69 | ....GenuntelineI
CPUID 00000001:00 = 00000673 00000000 00000000 0387fbff | s...............
CPUID 00000002:00 = 03020101 00000000 00000000 0c040844 | ............D...
CPUID 00000003:00 = 00000000 00000000 f5297dd1 0002c32d | .........}).-...
CPUID 40000000:00 = 00000000 00000000 00000000 00000000 | ................
CPUID 80000000:00 = 00000000 00000000 00000000 00000000 | ................
CPUID 80860000:00 = 00000000 00000000 00000000 00000000 | ................
CPUID c0000000:00 = 00000000 00000000 00000000 00000000 | ................
CPU 3:
CPUID 00000000:00 = 00000003 756e6547 6c65746e 49656e69 | ....GenuntelineI
CPUID 00000001:00 = 00000673 00000000 00000000 0387fbff | s...............
CPUID 00000002:00 = 03020101 00000000 00000000 0c040844 | ............D...
CPUID 00000003:00 = 00000000 00000000 f196cd7c 000000fd | ........|.......
CPUID 40000000:00 = 00000000 00000000 00000000 00000000 | ................
CPUID 80000000:00 = 00000000 00000000 00000000 00000000 | ................
CPUID 80860000:00 = 00000000 00000000 00000000 00000000 | ................
CPUID c0000000:00 = 00000000 00000000 00000000 00000000 | ................
CPU 4:
CPUID 00000000:00 = 00000003 756e6547 6c65746e 49656e69 | ....GenuntelineI
CPUID 00000001:00 = 00000673 00000000 00000000 0387fbff | s...............
CPUID 00000002:00 = 03020101 00000000 00000000 0c040844 | ............D...
CPUID 00000003:00 = 00000000 00000000 c6cadbe7 0003f185 | ................
CPUID 40000000:00 = 00000000 00000000 00000000 00000000 | ................
CPUID 80000000:00 = 00000000 00000000 00000000 00000000 | ................
CPUID 80860000:00 = 00000000 00000000 00000000 00000000 | ................
CPUID c0000000:00 = 00000000 00000000 00000000 00000000 | ................
CPU 5:
CPUID 00000000:00 = 00000003 756e6547 6c65746e 49656e69 | ....GenuntelineI
CPUID 00000001:00 = 00000673 00000000 00000000 0387fbff | s...............
CPUID 00000002:00 = 03020101 00000000 00000000 0c040844 | ............D...
CPUID 00000003:00 = 00000000 00000000 1b50bc4d 00011728 | ........M.P.(...
CPUID 40000000:00 = 00000000 00000000 00000000 00000000 | ................
CPUID 80000000:00 = 00000000 00000000 00000000 00000000 | ................
CPUID 80860000:00 = 00000000 00000000 00000000 00000000 | ................
CPUID c0000000:00 = 00000000 00000000 00000000 00000000 | ................
CPU 6:
CPUID 00000000:00 = 00000003 756e6547 6c65746e 49656e69 | ....GenuntelineI
CPUID 00000001:00 = 00000673 00000000 00000000 0387fbff | s...............
CPUID 00000002:00 = 03020101 00000000 00000000 0c040844 | ............D...
CPUID 00000003:00 = 00000000 00000000 4b995dea 00037587 | .........].K.u..
CPUID 40000000:00 = 00000000 00000000 00000000 00000000 | ................
CPUID 80000000:00 = 00000000 00000000 00000000 00000000 | ................
CPUID 80860000:00 = 00000000 00000000 00000000 00000000 | ................
CPUID c0000000:00 = 00000000 00000000 00000000 00000000 | ................
CPU 7:
CPUID 00000000:00 = 00000003 756e6547 6c65746e 49656e69 | ....GenuntelineI
CPUID 00000001:00 = 00000673 00000000 00000000 0387fbff | s...............
CPUID 00000002:00 = 03020101 00000000 00000000 0c040844 | ............D...
CPUID 00000003:00 = 00000000 00000000 8bce9534 00000e5b | ........4...[...
CPUID 40000000:00 = 00000000 00000000 00000000 00000000 | ................
CPUID 80000000:00 = 00000000 00000000 00000000 00000000 | ................
CPUID 80860000:00 = 00000000 00000000 00000000 00000000 | ................
CPUID c0000000:00 = 00000000 00000000 00000000 00000000 | ................
