CPU 0:
CPUID 00000000:00 = 0000000b 756e6547 6c65746e 49656e69 | ....GenuntelineI
CPUID 00000001:00 = 000506d1 00100800 02d8e20b 1f89fbff | ................
CPUID 00000002:00 = 61b3a001 0000ffc2 00000000 00000000 | ...a............
CPUID 00000003:00 = 00000000 00000000 00000000 00000000 | ................
CPUID 00000004:00 = 1c000121 0140003f 0000003f 00000001 | !...?.@.?.......
CPUID 00000004:01 = 1c000122 01c0003f 0000003f 00000001 | "...?...?.......
CPUID 00000004:02 = 1c00c143 01c0003f 000003ff 00000001 | C...?...........
CPUID 00000004:03 = 00000000 00000000 00000000 00000000 | ................
CPUID 00000005:00 = 00000040 00000040 00000003 03000020 | @...@....... ...
CPUID 00000006:00 = 00000000 00000000 00000000 00000000 | ................
CPUID 00000007:00 = 00000000 00002282 00000000 00000000 | ....."..........
CPUID 00000008:00 = 00000000 00000000 00000000 00000000 | ................
CPUID 00000009:00 = 00000000 00000000 00000000 00000000 | ................
CPUID 0000000a:00 = 07280203 00000000 00000000 00004503 | ..(..........E..
CPUID 0000000b:00 = 00000001 00000001 00000100 00000000 | ................
CPUID 0000000b:01 = 00000004 00000004 00000201 00000000 | ................
CPUID 40000000:00 = 00000000 00000000 00000000 00000000 | ................
CPUID 80000000:00 = 80000008 00000000 00000000 00000000 | ................
CPUID 80000001:00 = 00000000 00000000 00000101 28100000 | ...............(
CPUID 80000002:00 = 20202020 20202020 6e654720 656e6975 |          Genuine
CPUID 80000003:00 = 746e4920 52286c65 50432029 20202055 |  Intel(R) CPU   
CPUID 80000004:00 = 20202020 20402020 00383237 007a484d |       @ 728.MHz.
CPUID 80000005:00 = 00000000 00000000 00000000 00000000 | ................
CPUID 80000006:00 = 00000000 00000000 02006040 00000000 | ........@`......
CPUID 80000007:00 = 00000000 00000000 00000000 00000000 | ................
CPUID 80000008:00 = 00003020 00000000 00000000 00000000 |  0..............
CPUID 80860000:00 = 00000000 00000000 00000000 00000000 | ................
CPUID c0000000:00 = 00000000 00000000 00000000 00000000 | ................
