CPU 0:
CPUID 00000000:00 = 0000000a 756e6547 6c65746e 49656e69 | ....GenuntelineI
CPUID 00000001:00 = 00030661 00040800 0040e31d bfebfbff | a.........@.....
CPUID 00000002:00 = 4fba5901 0e3080c0 00000000 00000000 | .Y.O..0.........
CPUID 00000003:00 = 00000000 00000000 00000000 00000000 | ................
CPUID 00000004:00 = 04004121 0140003f 0000003f 00000001 | !A..?.@.?.......
CPUID 00000004:01 = 04004122 01c0003f 0000003f 00000001 | "A..?...?.......
CPUID 00000004:02 = 04004143 01c0003f 000003ff 00000001 | CA..?...........
CPUID 00000004:03 = 00000000 00000000 00000000 00000000 | ................
CPUID 00000005:00 = 00000040 00000040 00000003 00000010 | @...@...........
CPUID 00000006:00 = 00000005 00000002 00000003 00000000 | ................
CPUID 00000007:00 = 00000000 00000000 00000000 00000000 | ................
CPUID 00000008:00 = 00000000 00000000 00000000 00000000 | ................
CPUID 00000009:00 = 00000000 00000000 00000000 00000000 | ................
CPUID 0000000a:00 = 07280203 00000000 00000000 00000503 | ..(.............
CPUID 40000000:00 = 00000000 00000000 00000000 00000000 | ................
CPUID 80000000:00 = 80000008 00000000 00000000 00000000 | ................
CPUID 80000001:00 = 00000000 00000000 00000001 20100000 | ............... 
CPUID 80000002:00 = 20202020 20202020 65746e49 2952286c |         Intel(R)
CPUID 80000003:00 = 6f744120 4d54286d 50432029 32442055 |  Atom(TM) CPU D2
CPUID 80000004:00 = 20303037 20402020 33312e32 007a4847 | 700   @ 2.13GHz.
CPUID 80000005:00 = 00000000 00000000 00000000 00000000 | ................
CPUID 80000006:00 = 00000000 00000000 02006040 00000000 | ........@`......
CPUID 80000007:00 = 00000000 00000000 00000000 00000100 | ................
CPUID 80000008:00 = 00003024 00000000 00000000 00000000 | $0..............
CPUID 80860000:00 = 00000000 00000000 00000000 00000000 | ................
CPUID c0000000:00 = 00000000 00000000 00000000 00000000 | ................
CPU 1:
CPUID 00000000:00 = 0000000a 756e6547 6c65746e 49656e69 | ....GenuntelineI
CPUID 00000001:00 = 00030661 01040800 0040e31d bfebfbff | a.........@.....
CPUID 00000002:00 = 4fba5901 0e3080c0 00000000 00000000 | .Y.O..0.........
CPUID 00000003:00 = 00000000 00000000 00000000 00000000 | ................
CPUID 00000004:00 = 04004121 0140003f 0000003f 00000001 | !A..?.@.?.......
CPUID 00000004:01 = 04004122 01c0003f 0000003f 00000001 | "A..?...?.......
CPUID 00000004:02 = 04004143 01c0003f 000003ff 00000001 | CA..?...........
CPUID 00000004:03 = 00000000 00000000 00000000 00000000 | ................
CPUID 00000005:00 = 00000040 00000040 00000003 00000010 | @...@...........
CPUID 00000006:00 = 00000005 00000002 00000003 00000000 | ................
CPUID 00000007:00 = 00000000 00000000 00000000 00000000 | ................
CPUID 00000008:00 = 00000000 00000000 00000000 00000000 | ................
CPUID 00000009:00 = 00000000 00000000 00000000 00000000 | ................
CPUID 0000000a:00 = 07280203 00000000 00000000 00000503 | ..(.............
CPUID 40000000:00 = 00000000 00000000 00000000 00000000 | ................
CPUID 80000000:00 = 80000008 00000000 00000000 00000000 | ................
CPUID 80000001:00 = 00000000 00000000 00000001 20100000 | ............... 
CPUID 80000002:00 = 20202020 20202020 65746e49 2952286c |         Intel(R)
CPUID 80000003:00 = 6f744120 4d54286d 50432029 32442055 |  Atom(TM) CPU D2
CPUID 80000004:00 = 20303037 20402020 33312e32 007a4847 | 700   @ 2.13GHz.
CPUID 80000005:00 = 00000000 00000000 00000000 00000000 | ................
CPUID 80000006:00 = 00000000 00000000 02006040 00000000 | ........@`......
CPUID 80000007:00 = 00000000 00000000 00000000 00000100 | ................
CPUID 80000008:00 = 00003024 00000000 00000000 00000000 | $0..............
CPUID 80860000:00 = 00000000 00000000 00000000 00000000 | ................
CPUID c0000000:00 = 00000000 00000000 00000000 00000000 | ................
CPU 2:
CPUID 00000000:00 = 0000000a 756e6547 6c65746e 49656e69 | ....GenuntelineI
CPUID 00000001:00 = 00030661 02040800 0040e31d bfebfbff | a.........@.....
CPUID 00000002:00 = 4fba5901 0e3080c0 00000000 00000000 | .Y.O..0.........
CPUID 00000003:00 = 00000000 00000000 00000000 00000000 | ................
CPUID 00000004:00 = 04004121 0140003f 0000003f 00000001 | !A..?.@.?.......
CPUID 00000004:01 = 04004122 01c0003f 0000003f 00000001 | "A..?...?.......
CPUID 00000004:02 = 04004143 01c0003f 000003ff 00000001 | CA..?...........
CPUID 00000004:03 = 00000000 00000000 00000000 00000000 | ................
CPUID 00000005:00 = 00000040 00000040 00000003 00000010 | @...@...........
CPUID 00000006:00 = 00000005 00000002 00000003 00000000 | ................
CPUID 00000007:00 = 00000000 00000000 00000000 00000000 | ................
CPUID 00000008:00 = 00000000 00000000 00000000 00000000 | ................
CPUID 00000009:00 = 00000000 00000000 00000000 00000000 | ................
CPUID 0000000a:00 = 07280203 00000000 00000000 00000503 | ..(.............
CPUID 40000000:00 = 00000000 00000000 00000000 00000000 | ................
CPUID 80000000:00 = 80000008 00000000 00000000 00000000 | ................
CPUID 80000001:00 = 00000000 00000000 00000001 20100000 | ............... 
CPUID 80000002:00 = 20202020 20202020 65746e49 2952286c |         Intel(R)
CPUID 80000003:00 = 6f744120 4d54286d 50432029 32442055 |  Atom(TM) CPU D2
CPUID 80000004:00 = 20303037 20402020 33312e32 007a4847 | 700   @ 2.13GHz.
CPUID 80000005:00 = 00000000 00000000 00000000 00000000 | ................
CPUID 80000006:00 = 00000000 00000000 02006040 00000000 | ........@`......
CPUID 80000007:00 = 00000000 00000000 00000000 00000100 | ................
CPUID 80000008:00 = 00003024 00000000 00000000 00000000 | $0..............
CPUID 80860000:00 = 00000000 00000000 00000000 00000000 | ................
CPUID c0000000:00 = 00000000 00000000 00000000 00000000 | ................
CPU 3:
CPUID 00000000:00 = 0000000a 756e6547 6c65746e 49656e69 | ....GenuntelineI
CPUID 00000001:00 = 00030661 03040800 0040e31d bfebfbff | a.........@.....
CPUID 00000002:00 = 4fba5901 0e3080c0 00000000 00000000 | .Y.O..0.........
CPUID 00000003:00 = 00000000 00000000 00000000 00000000 | ................
CPUID 00000004:00 = 04004121 0140003f 0000003f 00000001 | !A..?.@.?.......
CPUID 00000004:01 = 04004122 01c0003f 0000003f 00000001 | "A..?...?.......
CPUID 00000004:02 = 04004143 01c0003f 000003ff 00000001 | CA..?...........
CPUID 00000004:03 = 00000000 00000000 00000000 00000000 | ................
CPUID 00000005:00 = 00000040 00000040 00000003 00000010 | @...@...........
CPUID 00000006:00 = 00000005 00000002 00000003 00000000 | ................
CPUID 00000007:00 = 00000000 00000000 00000000 00000000 | ................
CPUID 00000008:00 = 00000000 00000000 00000000 00000000 | ................
CPUID 00000009:00 = 00000000 00000000 00000000 00000000 | ................
CPUID 0000000a:00 = 07280203 00000000 00000000 00000503 | ..(.............
CPUID 40000000:00 = 00000000 00000000 00000000 00000000 | ................
CPUID 80000000:00 = 80000008 00000000 00000000 00000000 | ................
CPUID 80000001:00 = 00000000 00000000 00000001 20100000 | ............... 
CPUID 80000002:00 = 20202020 20202020 65746e49 2952286c |         Intel(R)
CPUID 80000003:00 = 6f744120 4d54286d 50432029 32442055 |  Atom(TM) CPU D2
CPUID 80000004:00 = 20303037 20402020 33312e32 007a4847 | 700   @ 2.13GHz.
CPUID 80000005:00 = 00000000 00000000 00000000 00000000 | ................
CPUID 80000006:00 = 00000000 00000000 02006040 00000000 | ........@`......
CPUID 80000007:00 = 00000000 00000000 00000000 00000100 | ................
CPUID 80000008:00 = 00003024 00000000 00000000 00000000 | $0..............
CPUID 80860000:00 = 00000000 00000000 00000000 00000000 | ................
CPUID c0000000:00 = 00000000 00000000 00000000 00000000 | ................
