CPU 0:
CPUID 00000000:00 = 00000016 756e6547 6c65746e 49656e69 | ....GenuntelineI
CPUID 00000001:00 = 00050657 00400800 7ffefbff bfebfbff | W.....@.........
CPUID 00000002:00 = 76036301 00f0b5ff 00000000 00c30000 | .c.v............
CPUID 00000003:00 = 00000000 00000000 00000000 00000000 | ................
CPUID 00000004:00 = 7c004121 01c0003f 0000003f 00000000 | !A.|?...?.......
CPUID 00000004:01 = 7c004122 01c0003f 0000003f 00000000 | "A.|?...?.......
CPUID 00000004:02 = 7c004143 03c0003f 000003ff 00000000 | CA.|?...........
CPUID 00000004:03 = 7c0fc163 0280003f 0000dfff 00000005 | c..|?...........
CPUID 00000004:04 = 00000000 00000000 00000000 00000000 | ................
CPUID 00000005:00 = 00000040 00000040 00000003 00002020 | @...@.......  ..
CPUID 00000006:00 = 00000af5 00000002 00000009 00000000 | ................
CPUID 00000007:00 = 00000000 d39ffffb 00000808 bc000400 | ................
CPUID 00000008:00 = 00000000 00000000 00000000 00000000 | ................
CPUID 00000009:00 = 00000000 00000000 00000000 00000000 | ................
CPUID 0000000a:00 = 07300404 00000000 00000000 00000603 | ..0.............
CPUID 0000000b:00 = 00000001 00000002 00000100 00000000 | ................
CPUID 0000000b:01 = 00000006 00000038 00000201 00000000 | ....8...........
CPUID 0000000c:00 = 00000000 00000000 00000000 00000000 | ................
CPUID 0000000d:00 = 000002ff 00000a80 00000a88 00000000 | ................
CPUID 0000000d:01 = 0000000f 00000a80 00000100 00000000 | ................
CPUID 0000000d:02 = 00000100 00000240 00000000 00000000 | ....@...........
CPUID 0000000d:03 = 00000040 000003c0 00000000 00000000 | @...............
CPUID 0000000d:04 = 00000040 00000400 00000000 00000000 | @...............
CPUID 0000000d:05 = 00000040 00000440 00000000 00000000 | @...@...........
CPUID 0000000d:06 = 00000200 00000480 00000000 00000000 | ................
CPUID 0000000d:07 = 00000400 00000680 00000000 00000000 | ................
CPUID 0000000d:08 = 00000080 00000000 00000001 00000000 | ................
CPUID 0000000e:00 = 00000000 00000000 00000000 00000000 | ................
CPUID 0000000f:00 = 00000000 000000df 00000000 00000002 | ................
CPUID 0000000f:01 = 0000000a 00000600 00000004 0000000f | ................
CPUID 00000010:00 = 00000000 0000000a 00000000 00000000 | ................
CPUID 00000010:01 = 00000000 00000000 00000000 00000000 | ................
CPUID 00000011:00 = 00000000 00000000 00000000 00000000 | ................
CPUID 00000012:00 = 00000000 00000000 00000000 00000000 | ................
CPUID 00000013:00 = 00000000 00000000 00000000 00000000 | ................
CPUID 00000014:00 = 00000001 0000000f 00000007 00000000 | ................
CPUID 00000014:01 = 02490002 003f3fff 00000000 00000000 | ..I..??.........
CPUID 00000015:00 = 00000002 000000d8 00000000 00000000 | ................
CPUID 00000016:00 = 00000a8c 00000fa0 00000064 00000000 | ........d.......
CPUID 40000000:00 = 00000000 00000000 00000000 00000000 | ................
CPUID 80000000:00 = 80000008 00000000 00000000 00000000 | ................
CPUID 80000001:00 = 00000000 00000000 00000121 2c100800 | ........!......,
CPUID 80000002:00 = 65746e49 2952286c 6f655820 2952286e | Intel(R) Xeon(R)
CPUID 80000003:00 = 616c5020 756e6974 3238206d 43203038 |  Platinum 8280 C
CPUID 80000004:00 = 40205550 372e3220 7a484730 00000000 | PU @ 2.70GHz....
CPUID 80000005:00 = 00000000 00000000 00000000 00000000 | ................
CPUID 80000006:00 = 00000000 00000000 01006040 00000000 | ........@`......
CPUID 80000007:00 = 00000000 00000000 00000000 00000100 | ................
CPUID 80000008:00 = 0000302e 00000000 00000000 00000000 | .0..............
CPUID 80860000:00 = 00000000 00000000 00000000 00000000 | ................
CPUID c0000000:00 = 00000000 00000000 00000000 00000000 | ................
