CPU 0:
CPUID 00000000:00 = 00000018 756e6547 6c65746e 49656e69 | ....GenuntelineI
CPUID 00000001:00 = 000706a8 00400800 4ff8ebbf bfebfbff | ......@....O....
CPUID 00000002:00 = 00feff01 00000000 00000000 00000000 | ................
CPUID 00000003:00 = 00000000 00000000 00000000 00000000 | ................
CPUID 00000004:00 = 7c000121 0140003f 0000003f 00000001 | !..|?.@.?.......
CPUID 00000004:01 = 7c000122 01c0003f 0000003f 00000001 | "..|?...?.......
CPUID 00000004:02 = 7c01c143 03c0003f 00000fff 00000001 | C..|?...........
CPUID 00000004:03 = 00000000 00000000 00000000 00000000 | ................
CPUID 00000005:00 = 00000040 00000040 00000003 11242020 | @...@.......  $.
CPUID 00000006:00 = 00000057 00000002 00000001 00000000 | W...............
CPUID 00000007:00 = 00000000 2294e287 40400004 ac000400 | ......."..@@....
CPUID 00000008:00 = 00000000 00000000 00000000 00000000 | ................
CPUID 00000009:00 = 00000000 00000000 00000000 00000000 | ................
CPUID 0000000a:00 = 07300404 00000000 00000000 00008603 | ..0.............
CPUID 0000000b:00 = 00000001 00000001 00000100 00000000 | ................
CPUID 0000000b:01 = 00000006 00000004 00000201 00000000 | ................
CPUID 0000000c:00 = 00000000 00000000 00000000 00000000 | ................
CPUID 0000000d:00 = 0000001b 00000440 00000440 00000000 | ....@...@.......
CPUID 0000000d:01 = 0000000f 00000340 00000100 00000000 | ....@...........
CPUID 0000000e:00 = 00000000 00000000 00000000 00000000 | ................
CPUID 0000000f:00 = 00000000 00000000 00000000 00000000 | ................
CPUID 00000010:00 = 00000000 00000004 00000000 00000000 | ................
CPUID 00000011:00 = 00000000 00000000 00000000 00000000 | ................
CPUID 00000012:00 = 00000000 00000000 00000000 00000000 | ................
CPUID 00000012:01 = 00000000 00000000 00000000 00000000 | ................
CPUID 00000013:00 = 00000000 00000000 00000000 00000000 | ................
CPUID 00000014:00 = 00000001 0000003f 80000007 00000000 | ....?...........
CPUID 00000014:01 = 02490002 003fffff 00000000 00000000 | ..I...?.........
CPUID 00000015:00 = 00000003 000000ab 0124f800 00000000 | ..........$.....
CPUID 00000016:00 = 00000000 00000000 00000000 00000000 | ................
CPUID 00000017:00 = 00000000 00000000 00000000 00000000 | ................
CPUID 00000018:00 = 00000004 00000000 00000000 00000000 | ................
CPUID 00000018:01 = 00000000 00200001 00000001 00000121 | ...... .....!...
CPUID 00000018:02 = 00000000 00040001 00000080 00000043 | ............C...
CPUID 00000018:03 = 00000000 00040006 00000008 00000043 | ............C...
CPUID 00000018:04 = 00000000 00300001 00000001 00000122 | ......0....."...
CPUID 40000000:00 = 00000000 00000000 00000000 00000000 | ................
CPUID 80000000:00 = 80000008 00000000 00000000 00000000 | ................
CPUID 80000001:00 = 00000000 00000000 00000101 2c100000 | ...............,
CPUID 80000002:00 = 65746e49 2952286c 6e655020 6d756974 | Intel(R) Pentium
CPUID 80000003:00 = 20295228 766c6953 4e207265 30333035 | (R) Silver N5030
CPUID 80000004:00 = 55504320 31204020 4730312e 00007a48 |  CPU @ 1.10GHz..
CPUID 80000005:00 = 00000000 00000000 00000000 00000000 | ................
CPUID 80000006:00 = 00000000 00000000 10008040 00000000 | ........@.......
CPUID 80000007:00 = 00000000 00000000 00000000 00000100 | ................
CPUID 80000008:00 = 00003027 00000000 00000000 00000000 | '0..............
CPUID 80860000:00 = 00000000 00000000 00000000 00000000 | ................
CPUID c0000000:00 = 00000000 00000000 00000000 00000000 | ................
CPU 1:
CPUID 00000000:00 = 00000018 756e6547 6c65746e 49656e69 | ....GenuntelineI
CPUID 00000001:00 = 000706a8 02400800 4ff8ebbf bfebfbff | ......@....O....
CPUID 00000002:00 = 00feff01 00000000 00000000 00000000 | ................
CPUID 00000003:00 = 00000000 00000000 00000000 00000000 | ................
CPUID 00000004:00 = 7c000121 0140003f 0000003f 00000001 | !..|?.@.?.......
CPUID 00000004:01 = 7c000122 01c0003f 0000003f 00000001 | "..|?...?.......
CPUID 00000004:02 = 7c01c143 03c0003f 00000fff 00000001 | C..|?...........
CPUID 00000004:03 = 00000000 00000000 00000000 00000000 | ................
CPUID 00000005:00 = 00000040 00000040 00000003 11242020 | @...@.......  $.
CPUID 00000006:00 = 00000057 00000002 00000001 00000000 | W...............
CPUID 00000007:00 = 00000000 2294e287 40400004 ac000400 | ......."..@@....
CPUID 00000008:00 = 00000000 00000000 00000000 00000000 | ................
CPUID 00000009:00 = 00000000 00000000 00000000 00000000 | ................
CPUID 0000000a:00 = 07300404 00000000 00000000 00008603 | ..0.............
CPUID 0000000b:00 = 00000001 00000001 00000100 00000002 | ................
CPUID 0000000b:01 = 00000006 00000004 00000201 00000002 | ................
CPUID 0000000c:00 = 00000000 00000000 00000000 00000000 | ................
CPUID 0000000d:00 = 0000001b 00000440 00000440 00000000 | ....@...@.......
CPUID 0000000d:01 = 0000000f 00000340 00000100 00000000 | ....@...........
CPUID 0000000e:00 = 00000000 00000000 00000000 00000000 | ................
CPUID 0000000f:00 = 00000000 00000000 00000000 00000000 | ................
CPUID 00000010:00 = 00000000 00000004 00000000 00000000 | ................
CPUID 00000011:00 = 00000000 00000000 00000000 00000000 | ................
CPUID 00000012:00 = 00000000 00000000 00000000 00000000 | ................
CPUID 00000012:01 = 00000000 00000000 00000000 00000000 | ................
CPUID 00000013:00 = 00000000 00000000 00000000 00000000 | ................
CPUID 00000014:00 = 00000001 0000003f 80000007 00000000 | ....?...........
CPUID 00000014:01 = 02490002 003fffff 00000000 00000000 | ..I...?.........
CPUID 00000015:00 = 00000003 000000ab 0124f800 00000000 | ..........$.....
CPUID 00000016:00 = 00000000 00000000 00000000 00000000 | ................
CPUID 00000017:00 = 00000000 00000000 00000000 00000000 | ................
CPUID 00000018:00 = 00000004 00000000 00000000 00000000 | ................
CPUID 00000018:01 = 00000000 00200001 00000001 00000121 | ...... .....!...
CPUID 00000018:02 = 00000000 00040001 00000080 00000043 | ............C...
CPUID 00000018:03 = 00000000 00040006 00000008 00000043 | ............C...
CPUID 00000018:04 = 00000000 00300001 00000001 00000122 | ......0....."...
CPUID 40000000:00 = 00000000 00000000 00000000 00000000 | ................
CPUID 80000000:00 = 80000008 00000000 00000000 00000000 | ................
CPUID 80000001:00 = 00000000 00000000 00000101 2c100000 | ...............,
CPUID 80000002:00 = 65746e49 2952286c 6e655020 6d756974 | Intel(R) Pentium
CPUID 80000003:00 = 20295228 766c6953 4e207265 30333035 | (R) Silver N5030
CPUID 80000004:00 = 55504320 31204020 4730312e 00007a48 |  CPU @ 1.10GHz..
CPUID 80000005:00 = 00000000 00000000 00000000 00000000 | ................
CPUID 80000006:00 = 00000000 00000000 10008040 00000000 | ........@.......
CPUID 80000007:00 = 00000000 00000000 00000000 00000100 | ................
CPUID 80000008:00 = 00003027 00000000 00000000 00000000 | '0..............
CPUID 80860000:00 = 00000000 00000000 00000000 00000000 | ................
CPUID c0000000:00 = 00000000 00000000 00000000 00000000 | ................
CPU 2:
CPUID 00000000:00 = 00000018 756e6547 6c65746e 49656e69 | ....GenuntelineI
CPUID 00000001:00 = 000706a8 04400800 4ff8ebbf bfebfbff | ......@....O....
CPUID 00000002:00 = 00feff01 00000000 00000000 00000000 | ................
CPUID 00000003:00 = 00000000 00000000 00000000 00000000 | ................
CPUID 00000004:00 = 7c000121 0140003f 0000003f 00000001 | !..|?.@.?.......
CPUID 00000004:01 = 7c000122 01c0003f 0000003f 00000001 | "..|?...?.......
CPUID 00000004:02 = 7c01c143 03c0003f 00000fff 00000001 | C..|?...........
CPUID 00000004:03 = 00000000 00000000 00000000 00000000 | ................
CPUID 00000005:00 = 00000040 00000040 00000003 11242020 | @...@.......  $.
CPUID 00000006:00 = 00000057 00000002 00000001 00000000 | W...............
CPUID 00000007:00 = 00000000 2294e287 40400004 ac000400 | ......."..@@....
CPUID 00000008:00 = 00000000 00000000 00000000 00000000 | ................
CPUID 00000009:00 = 00000000 00000000 00000000 00000000 | ................
CPUID 0000000a:00 = 07300404 00000000 00000000 00008603 | ..0.............
CPUID 0000000b:00 = 00000001 00000001 00000100 00000004 | ................
CPUID 0000000b:01 = 00000006 00000004 00000201 00000004 | ................
CPUID 0000000c:00 = 00000000 00000000 00000000 00000000 | ................
CPUID 0000000d:00 = 0000001b 00000440 00000440 00000000 | ....@...@.......
CPUID 0000000d:01 = 0000000f 00000340 00000100 00000000 | ....@...........
CPUID 0000000e:00 = 00000000 00000000 00000000 00000000 | ................
CPUID 0000000f:00 = 00000000 00000000 00000000 00000000 | ................
CPUID 00000010:00 = 00000000 00000004 00000000 00000000 | ................
CPUID 00000011:00 = 00000000 00000000 00000000 00000000 | ................
CPUID 00000012:00 = 00000000 00000000 00000000 00000000 | ................
CPUID 00000012:01 = 00000000 00000000 00000000 00000000 | ................
CPUID 00000013:00 = 00000000 00000000 00000000 00000000 | ................
CPUID 00000014:00 = 00000001 0000003f 80000007 00000000 | ....?...........
CPUID 00000014:01 = 02490002 003fffff 00000000 00000000 | ..I...?.........
CPUID 00000015:00 = 00000003 000000ab 0124f800 00000000 | ..........$.....
CPUID 00000016:00 = 00000000 00000000 00000000 00000000 | ................
CPUID 00000017:00 = 00000000 00000000 00000000 00000000 | ................
CPUID 00000018:00 = 00000004 00000000 00000000 00000000 | ................
CPUID 00000018:01 = 00000000 00200001 00000001 00000121 | ...... .....!...
CPUID 00000018:02 = 00000000 00040001 00000080 00000043 | ............C...
CPUID 00000018:03 = 00000000 00040006 00000008 00000043 | ............C...
CPUID 00000018:04 = 00000000 00300001 00000001 00000122 | ......0....."...
CPUID 40000000:00 = 00000000 00000000 00000000 00000000 | ................
CPUID 80000000:00 = 80000008 00000000 00000000 00000000 | ................
CPUID 80000001:00 = 00000000 00000000 00000101 2c100000 | ...............,
CPUID 80000002:00 = 65746e49 2952286c 6e655020 6d756974 | Intel(R) Pentium
CPUID 80000003:00 = 20295228 766c6953 4e207265 30333035 | (R) Silver N5030
CPUID 80000004:00 = 55504320 31204020 4730312e 00007a48 |  CPU @ 1.10GHz..
CPUID 80000005:00 = 00000000 00000000 00000000 00000000 | ................
CPUID 80000006:00 = 00000000 00000000 10008040 00000000 | ........@.......
CPUID 80000007:00 = 00000000 00000000 00000000 00000100 | ................
CPUID 80000008:00 = 00003027 00000000 00000000 00000000 | '0..............
CPUID 80860000:00 = 00000000 00000000 00000000 00000000 | ................
CPUID c0000000:00 = 00000000 00000000 00000000 00000000 | ................
CPU 3:
CPUID 00000000:00 = 00000018 756e6547 6c65746e 49656e69 | ....GenuntelineI
CPUID 00000001:00 = 000706a8 06400800 4ff8ebbf bfebfbff | ......@....O....
CPUID 00000002:00 = 00feff01 00000000 00000000 00000000 | ................
CPUID 00000003:00 = 00000000 00000000 00000000 00000000 | ................
CPUID 00000004:00 = 7c000121 0140003f 0000003f 00000001 | !..|?.@.?.......
CPUID 00000004:01 = 7c000122 01c0003f 0000003f 00000001 | "..|?...?.......
CPUID 00000004:02 = 7c01c143 03c0003f 00000fff 00000001 | C..|?...........
CPUID 00000004:03 = 00000000 00000000 00000000 00000000 | ................
CPUID 00000005:00 = 00000040 00000040 00000003 11242020 | @...@.......  $.
CPUID 00000006:00 = 00000057 00000002 00000001 00000000 | W...............
CPUID 00000007:00 = 00000000 2294e287 40400004 ac000400 | ......."..@@....
CPUID 00000008:00 = 00000000 00000000 00000000 00000000 | ................
CPUID 00000009:00 = 00000000 00000000 00000000 00000000 | ................
CPUID 0000000a:00 = 07300404 00000000 00000000 00008603 | ..0.............
CPUID 0000000b:00 = 00000001 00000001 00000100 00000006 | ................
CPUID 0000000b:01 = 00000006 00000004 00000201 00000006 | ................
CPUID 0000000c:00 = 00000000 00000000 00000000 00000000 | ................
CPUID 0000000d:00 = 0000001b 00000440 00000440 00000000 | ....@...@.......
CPUID 0000000d:01 = 0000000f 00000340 00000100 00000000 | ....@...........
CPUID 0000000e:00 = 00000000 00000000 00000000 00000000 | ................
CPUID 0000000f:00 = 00000000 00000000 00000000 00000000 | ................
CPUID 00000010:00 = 00000000 00000004 00000000 00000000 | ................
CPUID 00000011:00 = 00000000 00000000 00000000 00000000 | ................
CPUID 00000012:00 = 00000000 00000000 00000000 00000000 | ................
CPUID 00000012:01 = 00000000 00000000 00000000 00000000 | ................
CPUID 00000013:00 = 00000000 00000000 00000000 00000000 | ................
CPUID 00000014:00 = 00000001 0000003f 80000007 00000000 | ....?...........
CPUID 00000014:01 = 02490002 003fffff 00000000 00000000 | ..I...?.........
CPUID 00000015:00 = 00000003 000000ab 0124f800 00000000 | ..........$.....
CPUID 00000016:00 = 00000000 00000000 00000000 00000000 | ................
CPUID 00000017:00 = 00000000 00000000 00000000 00000000 | ................
CPUID 00000018:00 = 00000004 00000000 00000000 00000000 | ................
CPUID 00000018:01 = 00000000 00200001 00000001 00000121 | ...... .....!...
CPUID 00000018:02 = 00000000 00040001 00000080 00000043 | ............C...
CPUID 00000018:03 = 00000000 00040006 00000008 00000043 | ............C...
CPUID 00000018:04 = 00000000 00300001 00000001 00000122 | ......0....."...
CPUID 40000000:00 = 00000000 00000000 00000000 00000000 | ................
CPUID 80000000:00 = 80000008 00000000 00000000 00000000 | ................
CPUID 80000001:00 = 00000000 00000000 00000101 2c100000 | ...............,
CPUID 80000002:00 = 65746e49 2952286c 6e655020 6d756974 | Intel(R) Pentium
CPUID 80000003:00 = 20295228 766c6953 4e207265 30333035 | (R) Silver N5030
CPUID 80000004:00 = 55504320 31204020 4730312e 00007a48 |  CPU @ 1.10GHz..
CPUID 80000005:00 = 00000000 00000000 00000000 00000000 | ................
CPUID 80000006:00 = 00000000 00000000 10008040 00000000 | ........@.......
CPUID 80000007:00 = 00000000 00000000 00000000 00000100 | ................
CPUID 80000008:00 = 00003027 00000000 00000000 00000000 | '0..............
CPUID 80860000:00 = 00000000 00000000 00000000 00000000 | ................
CPUID c0000000:00 = 00000000 00000000 00000000 00000000 | ................
