CPU 0:
CPUID 00000000:00 = 0000000a 756e6547 6c65746e 49656e69 | ....GenuntelineI
CPUID 00000001:00 = 000006e8 00010800 0000c109 afe9fbff | ................
CPUID 00000002:00 = 02b3b001 000000f0 00000000 2c04307f | .............0.,
CPUID 00000003:00 = 00000000 00000000 00000000 00000000 | ................
CPUID 00000004:00 = 00000121 01c0003f 0000003f 00000001 | !...?...?.......
CPUID 00000004:01 = 00000122 01c0003f 0000003f 00000001 | "...?...?.......
CPUID 00000004:02 = 00000143 0040003f 00000fff 00000001 | C...?.@.........
CPUID 00000004:03 = 00000000 00000000 00000000 00000000 | ................
CPUID 00000005:00 = 00000040 00000040 00000003 00000010 | @...@...........
CPUID 00000006:00 = 00000001 00000002 00000001 00000000 | ................
CPUID 00000007:00 = 00000000 00000000 00000000 00000000 | ................
CPUID 00000008:00 = 00000000 00000000 00000000 00000000 | ................
CPUID 00000009:00 = 00000000 00000000 00000000 00000000 | ................
CPUID 0000000a:00 = 07280201 00000000 00000000 00000000 | ..(.............
CPUID 40000000:00 = 00000000 00000000 00000000 00000000 | ................
CPUID 80000000:00 = 80000008 00000000 00000000 00000000 | ................
CPUID 80000001:00 = 00000000 00000000 00000000 00100000 | ................
CPUID 80000002:00 = 65746e49 2952286c 6c654320 6e6f7265 | Intel(R) Celeron
CPUID 80000003:00 = 20295228 20555043 20202020 20202020 | (R) CPU         
CPUID 80000004:00 = 35313220 20402020 33332e31 007a4847 |  215  @ 1.33GHz.
CPUID 80000005:00 = 00000000 00000000 00000000 00000000 | ................
CPUID 80000006:00 = 00000000 00000000 02002040 00000000 | ........@ ......
CPUID 80000007:00 = 00000000 00000000 00000000 00000000 | ................
CPUID 80000008:00 = 00002020 00000000 00000000 00000000 |   ..............
CPUID 80860000:00 = 00000000 00000000 00000000 00000000 | ................
CPUID c0000000:00 = 00000000 00000000 00000000 00000000 | ................
