CPU 0:
CPUID 00000000:00 = 0000000d 756e6547 6c65746e 49656e69 | ....GenuntelineI
CPUID 00000001:00 = 00050671 00ff0800 7ff8f39f bfebfbff | q...............
CPUID 00000002:00 = 6c6b6a01 00ff616d 00000000 00000000 | .jklma..........
CPUID 00000003:00 = 00000000 00000000 00000000 00000000 | ................
CPUID 00000004:00 = fc00c121 01c0003f 0000003f 00000000 | !...?...?.......
CPUID 00000004:01 = fc00c122 01c0003f 0000003f 00000000 | "...?...?.......
CPUID 00000004:02 = fc01c143 03c0003f 000003ff 00000013 | C...?...........
CPUID 00000004:03 = 00000000 00000000 00000000 00000000 | ................
CPUID 00000005:00 = 00000040 00000040 00000003 00000110 | @...@...........
CPUID 00000006:00 = 00000077 00000002 00000009 00000000 | w...............
CPUID 00000007:00 = 00000000 1c0d23ab 00000001 00000000 | .....#..........
CPUID 00000008:00 = 00000000 00000000 00000000 00000000 | ................
CPUID 00000009:00 = 00000000 00000000 00000000 00000000 | ................
CPUID 0000000a:00 = 07280203 00000000 00000000 00000503 | ..(.............
CPUID 0000000b:00 = 00000002 00000004 00000100 00000000 | ................
CPUID 0000000b:01 = 00000009 00000120 00000201 00000000 | .... ...........
CPUID 0000000c:00 = 00000000 00000000 00000000 00000000 | ................
CPUID 0000000d:00 = 000000e7 00000a80 00000a80 00000000 | ................
CPUID 0000000d:01 = 00000001 00000000 00000000 00000000 | ................
CPUID 0000000d:02 = 00000100 00000240 00000000 00000000 | ....@...........
CPUID 40000000:00 = 00000000 00000000 00000000 00000000 | ................
CPUID 80000000:00 = 80000008 00000000 00000000 00000000 | ................
CPUID 80000001:00 = 00000000 00000000 00000121 2c100800 | ........!......,
CPUID 80000002:00 = 65746e49 2952286c 6f655820 6850206e | Intel(R) Xeon Ph
CPUID 80000003:00 = 4d542869 50432029 32372055 40203039 | i(TM) CPU 7290 @
CPUID 80000004:00 = 352e3120 7a484730 00000000 00000000 |  1.50GHz........
CPUID 80000005:00 = 00000000 00000000 00000000 00000000 | ................
CPUID 80000006:00 = 00000000 00000000 04008040 00000000 | ........@.......
CPUID 80000007:00 = 00000000 00000000 00000000 00000100 | ................
CPUID 80000008:00 = 0000302e 00000000 00000000 00000000 | .0..............
CPUID 80860000:00 = 00000000 00000000 00000000 00000000 | ................
CPUID c0000000:00 = 00000000 00000000 00000000 00000000 | ................
