CPU 0:
CPUID 00000000:00 = 00000002 756e6547 6c65746e 49656e69 | ....GenuntelineI
CPUID 00000001:00 = 00010650 00000800 00000000 8fe9fbff | P...............
CPUID 00000002:00 = 02b3b001 000000f0 00000000 2c04303f | ............?0.,
CPUID 40000000:00 = 00000000 00000000 00000000 00000000 | ................
CPUID 80000000:00 = 80000008 00000000 00000000 00000000 | ................
CPUID 80000001:00 = 00000000 00000000 00000000 00000000 | ................
CPUID 80000002:00 = 756e6547 20656e69 65746e49 2952286c | Genuine Intel(R)
CPUID 80000003:00 = 6f727020 73736563 2020726f 20202020 |  processor      
CPUID 80000004:00 = 20202020 20202020 30303820 007a484d |          800MHz.
CPUID 80000005:00 = 00000000 00000000 00000000 00000000 | ................
CPUID 80000006:00 = 00000000 00000000 01002040 00000000 | ........@ ......
CPUID 80000007:00 = 00000000 00000000 00000000 00000000 | ................
CPUID 80000008:00 = 00002020 00000000 00000000 00000000 |   ..............
CPUID 80860000:00 = 00000000 00000000 00000000 00000000 | ................
CPUID c0000000:00 = 00000000 00000000 00000000 00000000 | ................
