CPU 0:
CPUID 00000000:00 = 00000016 756e6547 6c65746e 49656e69 | ....GenuntelineI
CPUID 00000001:00 = 00060663 00100800 7ffafbbf bfebfbff | c...............
CPUID 00000002:00 = 76036301 00f0b5ff 00000000 00c30000 | .c.v............
CPUID 00000003:00 = 00000000 00000000 00000000 00000000 | ................
CPUID 00000004:00 = 1c004121 01c0003f 0000003f 00000000 | !A..?...?.......
CPUID 00000004:01 = 1c004122 01c0003f 0000003f 00000000 | "A..?...?.......
CPUID 00000004:02 = 1c004143 00c0003f 000003ff 00000000 | CA..?...........
CPUID 00000004:03 = 1c03c163 03c0003f 00000fff 00000006 | c...?...........
CPUID 00000004:04 = 00000000 00000000 00000000 00000000 | ................
CPUID 00000005:00 = 00000040 00000040 00000003 11142020 | @...@.......  ..
CPUID 00000006:00 = 00002ff7 00000002 00000009 00000000 | ./..............
CPUID 00000007:00 = 00000000 f2bf67eb 0000000e 9c000000 | .....g..........
CPUID 00000008:00 = 00000000 00000000 00000000 00000000 | ................
CPUID 00000009:00 = 00000000 00000000 00000000 00000000 | ................
CPUID 0000000a:00 = 07300404 00000000 00000000 00000603 | ..0.............
CPUID 0000000b:00 = 00000001 00000002 00000100 00000000 | ................
CPUID 0000000b:01 = 00000004 00000004 00000201 00000000 | ................
CPUID 0000000c:00 = 00000000 00000000 00000000 00000000 | ................
CPUID 0000000d:00 = 000002ff 00000a80 00000a88 00000000 | ................
CPUID 0000000d:01 = 0000000f 00000a80 00000100 00000000 | ................
CPUID 0000000d:02 = 00000100 00000240 00000000 00000000 | ....@...........
CPUID 0000000d:03 = 00000040 000003c0 00000000 00000000 | @...............
CPUID 0000000d:04 = 00000040 00000400 00000000 00000000 | @...............
CPUID 0000000d:05 = 00000040 00000440 00000000 00000000 | @...@...........
CPUID 0000000d:06 = 00000200 00000480 00000000 00000000 | ................
CPUID 0000000d:07 = 00000400 00000680 00000000 00000000 | ................
CPUID 0000000d:08 = 00000080 00000000 00000001 00000000 | ................
CPUID 0000000d:09 = 00000008 00000a80 00000000 00000000 | ................
CPUID 0000000e:00 = 00000000 00000000 00000000 00000000 | ................
CPUID 0000000f:00 = 00000000 00000000 00000000 00000000 | ................
CPUID 00000010:00 = 00000000 00000000 00000000 00000000 | ................
CPUID 00000011:00 = 00000000 00000000 00000000 00000000 | ................
CPUID 00000012:00 = 00000000 00000000 00000000 00000000 | ................
CPUID 00000013:00 = 00000000 00000000 00000000 00000000 | ................
CPUID 00000014:00 = 00000001 0000000f 00000007 00000000 | ................
CPUID 00000014:01 = 02490002 003f1fff 00000000 00000000 | ..I...?.........
CPUID 00000015:00 = 00000002 000000b8 016e3600 00000000 | .........6n.....
CPUID 00000016:00 = 00000898 00000c80 00000064 00000000 | ........d.......
CPUID 40000000:00 = 00000000 00000000 00000000 00000000 | ................
CPUID 80000000:00 = 80000008 00000000 00000000 00000000 | ................
CPUID 80000001:00 = 00000000 00000000 00000121 2c100000 | ........!......,
CPUID 80000002:00 = 65746e49 2952286c 726f4320 4d542865 | Intel(R) Core(TM
CPUID 80000003:00 = 33692029 3231382d 43205531 40205550 | ) i3-8121U CPU @
CPUID 80000004:00 = 322e3220 7a484730 00000000 00000000 |  2.20GHz........
CPUID 80000005:00 = 00000000 00000000 00000000 00000000 | ................
CPUID 80000006:00 = 00000000 00000000 01006040 00000000 | ........@`......
CPUID 80000007:00 = 00000000 00000000 00000000 00000100 | ................
CPUID 80000008:00 = 00003027 00000000 00000000 00000000 | '0..............
CPUID 80860000:00 = 00000000 00000000 00000000 00000000 | ................
CPUID c0000000:00 = 00000000 00000000 00000000 00000000 | ................
CPU 1:
CPUID 00000000:00 = 00000016 756e6547 6c65746e 49656e69 | ....GenuntelineI
CPUID 00000001:00 = 00060663 01100800 7ffafbbf bfebfbff | c...............
CPUID 00000002:00 = 76036301 00f0b5ff 00000000 00c30000 | .c.v............
CPUID 00000003:00 = 00000000 00000000 00000000 00000000 | ................
CPUID 00000004:00 = 1c004121 01c0003f 0000003f 00000000 | !A..?...?.......
CPUID 00000004:01 = 1c004122 01c0003f 0000003f 00000000 | "A..?...?.......
CPUID 00000004:02 = 1c004143 00c0003f 000003ff 00000000 | CA..?...........
CPUID 00000004:03 = 1c03c163 03c0003f 00000fff 00000006 | c...?...........
CPUID 00000004:04 = 00000000 00000000 00000000 00000000 | ................
CPUID 00000005:00 = 00000040 00000040 00000003 11142020 | @...@.......  ..
CPUID 00000006:00 = 00002ff7 00000002 00000009 00000000 | ./..............
CPUID 00000007:00 = 00000000 f2bf67eb 0000000e 9c000000 | .....g..........
CPUID 00000008:00 = 00000000 00000000 00000000 00000000 | ................
CPUID 00000009:00 = 00000000 00000000 00000000 00000000 | ................
CPUID 0000000a:00 = 07300404 00000000 00000000 00000603 | ..0.............
CPUID 0000000b:00 = 00000001 00000002 00000100 00000001 | ................
CPUID 0000000b:01 = 00000004 00000004 00000201 00000001 | ................
CPUID 0000000c:00 = 00000000 00000000 00000000 00000000 | ................
CPUID 0000000d:00 = 000002ff 00000a80 00000a88 00000000 | ................
CPUID 0000000d:01 = 0000000f 00000a80 00000100 00000000 | ................
CPUID 0000000d:02 = 00000100 00000240 00000000 00000000 | ....@...........
CPUID 0000000d:03 = 00000040 000003c0 00000000 00000000 | @...............
CPUID 0000000d:04 = 00000040 00000400 00000000 00000000 | @...............
CPUID 0000000d:05 = 00000040 00000440 00000000 00000000 | @...@...........
CPUID 0000000d:06 = 00000200 00000480 00000000 00000000 | ................
CPUID 0000000d:07 = 00000400 00000680 00000000 00000000 | ................
CPUID 0000000d:08 = 00000080 00000000 00000001 00000000 | ................
CPUID 0000000d:09 = 00000008 00000a80 00000000 00000000 | ................
CPUID 0000000e:00 = 00000000 00000000 00000000 00000000 | ................
CPUID 0000000f:00 = 00000000 00000000 00000000 00000000 | ................
CPUID 00000010:00 = 00000000 00000000 00000000 00000000 | ................
CPUID 00000011:00 = 00000000 00000000 00000000 00000000 | ................
CPUID 00000012:00 = 00000000 00000000 00000000 00000000 | ................
CPUID 00000013:00 = 00000000 00000000 00000000 00000000 | ................
CPUID 00000014:00 = 00000001 0000000f 00000007 00000000 | ................
CPUID 00000014:01 = 02490002 003f1fff 00000000 00000000 | ..I...?.........
CPUID 00000015:00 = 00000002 000000b8 016e3600 00000000 | .........6n.....
CPUID 00000016:00 = 00000898 00000c80 00000064 00000000 | ........d.......
CPUID 40000000:00 = 00000000 00000000 00000000 00000000 | ................
CPUID 80000000:00 = 80000008 00000000 00000000 00000000 | ................
CPUID 80000001:00 = 00000000 00000000 00000121 2c100000 | ........!......,
CPUID 80000002:00 = 65746e49 2952286c 726f4320 4d542865 | Intel(R) Core(TM
CPUID 80000003:00 = 33692029 3231382d 43205531 40205550 | ) i3-8121U CPU @
CPUID 80000004:00 = 322e3220 7a484730 00000000 00000000 |  2.20GHz........
CPUID 80000005:00 = 00000000 00000000 00000000 00000000 | ................
CPUID 80000006:00 = 00000000 00000000 01006040 00000000 | ........@`......
CPUID 80000007:00 = 00000000 00000000 00000000 00000100 | ................
CPUID 80000008:00 = 00003027 00000000 00000000 00000000 | '0..............
CPUID 80860000:00 = 00000000 00000000 00000000 00000000 | ................
CPUID c0000000:00 = 00000000 00000000 00000000 00000000 | ................
CPU 2:
CPUID 00000000:00 = 00000016 756e6547 6c65746e 49656e69 | ....GenuntelineI
CPUID 00000001:00 = 00060663 02100800 7ffafbbf bfebfbff | c...............
CPUID 00000002:00 = 76036301 00f0b5ff 00000000 00c30000 | .c.v............
CPUID 00000003:00 = 00000000 00000000 00000000 00000000 | ................
CPUID 00000004:00 = 1c004121 01c0003f 0000003f 00000000 | !A..?...?.......
CPUID 00000004:01 = 1c004122 01c0003f 0000003f 00000000 | "A..?...?.......
CPUID 00000004:02 = 1c004143 00c0003f 000003ff 00000000 | CA..?...........
CPUID 00000004:03 = 1c03c163 03c0003f 00000fff 00000006 | c...?...........
CPUID 00000004:04 = 00000000 00000000 00000000 00000000 | ................
CPUID 00000005:00 = 00000040 00000040 00000003 11142020 | @...@.......  ..
CPUID 00000006:00 = 00002ff7 00000002 00000009 00000000 | ./..............
CPUID 00000007:00 = 00000000 f2bf67eb 0000000e 9c000000 | .....g..........
CPUID 00000008:00 = 00000000 00000000 00000000 00000000 | ................
CPUID 00000009:00 = 00000000 00000000 00000000 00000000 | ................
CPUID 0000000a:00 = 07300404 00000000 00000000 00000603 | ..0.............
CPUID 0000000b:00 = 00000001 00000002 00000100 00000002 | ................
CPUID 0000000b:01 = 00000004 00000004 00000201 00000002 | ................
CPUID 0000000c:00 = 00000000 00000000 00000000 00000000 | ................
CPUID 0000000d:00 = 000002ff 00000a80 00000a88 00000000 | ................
CPUID 0000000d:01 = 0000000f 00000a80 00000100 00000000 | ................
CPUID 0000000d:02 = 00000100 00000240 00000000 00000000 | ....@...........
CPUID 0000000d:03 = 00000040 000003c0 00000000 00000000 | @...............
CPUID 0000000d:04 = 00000040 00000400 00000000 00000000 | @...............
CPUID 0000000d:05 = 00000040 00000440 00000000 00000000 | @...@...........
CPUID 0000000d:06 = 00000200 00000480 00000000 00000000 | ................
CPUID 0000000d:07 = 00000400 00000680 00000000 00000000 | ................
CPUID 0000000d:08 = 00000080 00000000 00000001 00000000 | ................
CPUID 0000000d:09 = 00000008 00000a80 00000000 00000000 | ................
CPUID 0000000e:00 = 00000000 00000000 00000000 00000000 | ................
CPUID 0000000f:00 = 00000000 00000000 00000000 00000000 | ................
CPUID 00000010:00 = 00000000 00000000 00000000 00000000 | ................
CPUID 00000011:00 = 00000000 00000000 00000000 00000000 | ................
CPUID 00000012:00 = 00000000 00000000 00000000 00000000 | ................
CPUID 00000013:00 = 00000000 00000000 00000000 00000000 | ................
CPUID 00000014:00 = 00000001 0000000f 00000007 00000000 | ................
CPUID 00000014:01 = 02490002 003f1fff 00000000 00000000 | ..I...?.........
CPUID 00000015:00 = 00000002 000000b8 016e3600 00000000 | .........6n.....
CPUID 00000016:00 = 00000898 00000c80 00000064 00000000 | ........d.......
CPUID 40000000:00 = 00000000 00000000 00000000 00000000 | ................
CPUID 80000000:00 = 80000008 00000000 00000000 00000000 | ................
CPUID 80000001:00 = 00000000 00000000 00000121 2c100000 | ........!......,
CPUID 80000002:00 = 65746e49 2952286c 726f4320 4d542865 | Intel(R) Core(TM
CPUID 80000003:00 = 33692029 3231382d 43205531 40205550 | ) i3-8121U CPU @
CPUID 80000004:00 = 322e3220 7a484730 00000000 00000000 |  2.20GHz........
CPUID 80000005:00 = 00000000 00000000 00000000 00000000 | ................
CPUID 80000006:00 = 00000000 00000000 01006040 00000000 | ........@`......
CPUID 80000007:00 = 00000000 00000000 00000000 00000100 | ................
CPUID 80000008:00 = 00003027 00000000 00000000 00000000 | '0..............
CPUID 80860000:00 = 00000000 00000000 00000000 00000000 | ................
CPUID c0000000:00 = 00000000 00000000 00000000 00000000 | ................
CPU 3:
CPUID 00000000:00 = 00000016 756e6547 6c65746e 49656e69 | ....GenuntelineI
CPUID 00000001:00 = 00060663 03100800 7ffafbbf bfebfbff | c...............
CPUID 00000002:00 = 76036301 00f0b5ff 00000000 00c30000 | .c.v............
CPUID 00000003:00 = 00000000 00000000 00000000 00000000 | ................
CPUID 00000004:00 = 1c004121 01c0003f 0000003f 00000000 | !A..?...?.......
CPUID 00000004:01 = 1c004122 01c0003f 0000003f 00000000 | "A..?...?.......
CPUID 00000004:02 = 1c004143 00c0003f 000003ff 00000000 | CA..?...........
CPUID 00000004:03 = 1c03c163 03c0003f 00000fff 00000006 | c...?...........
CPUID 00000004:04 = 00000000 00000000 00000000 00000000 | ................
CPUID 00000005:00 = 00000040 00000040 00000003 11142020 | @...@.......  ..
CPUID 00000006:00 = 00002ff7 00000002 00000009 00000000 | ./..............
CPUID 00000007:00 = 00000000 f2bf67eb 0000000e 9c000000 | .....g..........
CPUID 00000008:00 = 00000000 00000000 00000000 00000000 | ................
CPUID 00000009:00 = 00000000 00000000 00000000 00000000 | ................
CPUID 0000000a:00 = 07300404 00000000 00000000 00000603 | ..0.............
CPUID 0000000b:00 = 00000001 00000002 00000100 00000003 | ................
CPUID 0000000b:01 = 00000004 00000004 00000201 00000003 | ................
CPUID 0000000c:00 = 00000000 00000000 00000000 00000000 | ................
CPUID 0000000d:00 = 000002ff 00000a80 00000a88 00000000 | ................
CPUID 0000000d:01 = 0000000f 00000a80 00000100 00000000 | ................
CPUID 0000000d:02 = 00000100 00000240 00000000 00000000 | ....@...........
CPUID 0000000d:03 = 00000040 000003c0 00000000 00000000 | @...............
CPUID 0000000d:04 = 00000040 00000400 00000000 00000000 | @...............
CPUID 0000000d:05 = 00000040 00000440 00000000 00000000 | @...@...........
CPUID 0000000d:06 = 00000200 00000480 00000000 00000000 | ................
CPUID 0000000d:07 = 00000400 00000680 00000000 00000000 | ................
CPUID 0000000d:08 = 00000080 00000000 00000001 00000000 | ................
CPUID 0000000d:09 = 00000008 00000a80 00000000 00000000 | ................
CPUID 0000000e:00 = 00000000 00000000 00000000 00000000 | ................
CPUID 0000000f:00 = 00000000 00000000 00000000 00000000 | ................
CPUID 00000010:00 = 00000000 00000000 00000000 00000000 | ................
CPUID 00000011:00 = 00000000 00000000 00000000 00000000 | ................
CPUID 00000012:00 = 00000000 00000000 00000000 00000000 | ................
CPUID 00000013:00 = 00000000 00000000 00000000 00000000 | ................
CPUID 00000014:00 = 00000001 0000000f 00000007 00000000 | ................
CPUID 00000014:01 = 02490002 003f1fff 00000000 00000000 | ..I...?.........
CPUID 00000015:00 = 00000002 000000b8 016e3600 00000000 | .........6n.....
CPUID 00000016:00 = 00000898 00000c80 00000064 00000000 | ........d.......
CPUID 40000000:00 = 00000000 00000000 00000000 00000000 | ................
CPUID 80000000:00 = 80000008 00000000 00000000 00000000 | ................
CPUID 80000001:00 = 00000000 00000000 00000121 2c100000 | ........!......,
CPUID 80000002:00 = 65746e49 2952286c 726f4320 4d542865 | Intel(R) Core(TM
CPUID 80000003:00 = 33692029 3231382d 43205531 40205550 | ) i3-8121U CPU @
CPUID 80000004:00 = 322e3220 7a484730 00000000 00000000 |  2.20GHz........
CPUID 80000005:00 = 00000000 00000000 00000000 00000000 | ................
CPUID 80000006:00 = 00000000 00000000 01006040 00000000 | ........@`......
CPUID 80000007:00 = 00000000 00000000 00000000 00000100 | ................
CPUID 80000008:00 = 00003027 00000000 00000000 00000000 | '0..............
CPUID 80860000:00 = 00000000 00000000 00000000 00000000 | ................
CPUID c0000000:00 = 00000000 00000000 00000000 00000000 | ................
