CPU 0:
CPUID 00000000:00 = 00000016 756e6547 6c65746e 49656e69 | ....GenuntelineI
CPUID 00000001:00 = 000906ec 00100800 7ffafbff bfebfbff | ................
CPUID 00000002:00 = 76036301 00f0b5ff 00000000 00c30000 | .c.v............
CPUID 00000003:00 = 00000000 00000000 00000000 00000000 | ................
CPUID 00000004:00 = 1c004121 01c0003f 0000003f 00000000 | !A..?...?.......
CPUID 00000004:01 = 1c004122 01c0003f 0000003f 00000000 | "A..?...?.......
CPUID 00000004:02 = 1c004143 00c0003f 000003ff 00000000 | CA..?...........
CPUID 00000004:03 = 1c03c163 03c0003f 00003fff 00000006 | c...?....?......
CPUID 00000004:04 = 00000000 00000000 00000000 00000000 | ................
CPUID 00000005:00 = 00000040 00000040 00000003 11142120 | @...@....... !..
CPUID 00000006:00 = 000027f7 00000002 00000009 00000000 | .'..............
CPUID 00000007:00 = 00000000 029c6fbf 40000000 bc000000 | .....o.....@....
CPUID 00000008:00 = 00000000 00000000 00000000 00000000 | ................
CPUID 00000009:00 = 00000000 00000000 00000000 00000000 | ................
CPUID 0000000a:00 = 07300404 00000000 00000000 00000603 | ..0.............
CPUID 0000000b:00 = 00000001 00000002 00000100 00000000 | ................
CPUID 0000000b:01 = 00000004 00000010 00000201 00000000 | ................
CPUID 0000000c:00 = 00000000 00000000 00000000 00000000 | ................
CPUID 0000000d:00 = 0000001f 00000440 00000440 00000000 | ....@...@.......
CPUID 0000000d:01 = 0000000f 00000440 00000100 00000000 | ....@...........
CPUID 0000000d:02 = 00000100 00000240 00000000 00000000 | ....@...........
CPUID 0000000d:03 = 00000040 000003c0 00000000 00000000 | @...............
CPUID 0000000d:04 = 00000040 00000400 00000000 00000000 | @...............
CPUID 0000000e:00 = 00000000 00000000 00000000 00000000 | ................
CPUID 0000000f:00 = 00000000 00000000 00000000 00000000 | ................
CPUID 00000010:00 = 00000000 00000000 00000000 00000000 | ................
CPUID 00000011:00 = 00000000 00000000 00000000 00000000 | ................
CPUID 00000012:00 = 00000001 00000000 00000000 0000241f | .............$..
CPUID 00000012:01 = 00000000 00000000 00000000 00000000 | ................
CPUID 00000013:00 = 00000000 00000000 00000000 00000000 | ................
CPUID 00000014:00 = 00000001 0000000f 00000007 00000000 | ................
CPUID 00000014:01 = 00000000 00000000 00000000 00000000 | ................
CPUID 00000015:00 = 00000002 0000012c 00000000 00000000 | ....,...........
CPUID 00000016:00 = 00000e10 00001388 00000064 00000000 | ........d.......
CPUID 40000000:00 = 00000000 00000000 00000000 00000000 | ................
CPUID 80000000:00 = 80000008 00000000 00000000 00000000 | ................
CPUID 80000001:00 = 00000000 00000000 00000121 2c100800 | ........!......,
CPUID 80000002:00 = 65746e49 2952286c 726f4320 4d542865 | Intel(R) Core(TM
CPUID 80000003:00 = 39692029 3039392d 43204b30 40205550 | ) i9-9900K CPU @
CPUID 80000004:00 = 362e3320 7a484730 00000000 00000000 |  3.60GHz........
CPUID 80000005:00 = 00000000 00000000 00000000 00000000 | ................
CPUID 80000006:00 = 00000000 00000000 01006040 00000000 | ........@`......
CPUID 80000007:00 = 00000000 00000000 00000000 00000100 | ................
CPUID 80000008:00 = 00003027 00000000 00000000 00000000 | '0..............
CPUID 80860000:00 = 00000000 00000000 00000000 00000000 | ................
CPUID c0000000:00 = 00000000 00000000 00000000 00000000 | ................
