CPU 0:
CPUID 00000000:00 = 00000005 756e6547 6c65746e 49656e69 | ....GenuntelineI
CPUID 00000001:00 = 00000f41 00010800 0000651d bfebfbff | A........e......
CPUID 00000002:00 = 605b5101 00000000 00000000 003c7040 | .Q[`........@p<.
CPUID 00000003:00 = 00000000 00000000 00000000 00000000 | ................
CPUID 00000004:00 = 00000121 01c0003f 0000001f 00000000 | !...?...........
CPUID 00000004:01 = 00000143 00c0103f 000001ff 00000000 | C...?...........
CPUID 00000004:02 = 00000000 00000000 00000000 00000000 | ................
CPUID 00000005:00 = 00000040 00000040 00000000 00000000 | @...@...........
CPUID 40000000:00 = 00000000 00000000 00000000 00000000 | ................
CPUID 80000000:00 = 80000008 00000000 00000000 00000000 | ................
CPUID 80000001:00 = 00000000 00000000 00000000 20100000 | ............... 
CPUID 80000002:00 = 20202020 20202020 20202020 20202020 |                 
CPUID 80000003:00 = 65746e49 2952286c 6c654320 6e6f7265 | Intel(R) Celeron
CPUID 80000004:00 = 20295228 20555043 33352e32 007a4847 | (R) CPU 2.53GHz.
CPUID 80000005:00 = 00000000 00000000 00000000 00000000 | ................
CPUID 80000006:00 = 00000000 00000000 01004040 00000000 | ........@@......
CPUID 80000007:00 = 00000000 00000000 00000000 00000000 | ................
CPUID 80000008:00 = 00003024 00000000 00000000 00000000 | $0..............
CPUID 80860000:00 = 00000000 00000000 00000000 00000000 | ................
CPUID c0000000:00 = 00000000 00000000 00000000 00000000 | ................
