CPU 0:
CPUID 00000000:00 = 0000000d 756e6547 6c65746e 49656e69 | ....GenuntelineI
CPUID 00000001:00 = 000306c3 00100800 7ffafbff bfebfbff | ................
CPUID 00000002:00 = 76036301 00f0b5ff 00000000 00c10000 | .c.v............
CPUID 00000003:00 = 00000000 00000000 00000000 00000000 | ................
CPUID 00000004:00 = 1c004121 01c0003f 0000003f 00000000 | !A..?...?.......
CPUID 00000004:01 = 1c004122 01c0003f 0000003f 00000000 | "A..?...?.......
CPUID 00000004:02 = 1c004143 01c0003f 000001ff 00000000 | CA..?...........
CPUID 00000004:03 = 1c03c163 03c0003f 00001fff 00000006 | c...?...........
CPUID 00000004:04 = 00000000 00000000 00000000 00000000 | ................
CPUID 00000005:00 = 00000040 00000040 00000003 00042120 | @...@....... !..
CPUID 00000006:00 = 00000075 00000002 00000009 00000000 | u...............
CPUID 00000007:00 = 00000000 000027ab 00000000 00000000 | .....'..........
CPUID 00000008:00 = 00000000 00000000 00000000 00000000 | ................
CPUID 00000009:00 = 00000000 00000000 00000000 00000000 | ................
CPUID 0000000a:00 = 07300403 00000000 00000000 00000603 | ..0.............
CPUID 0000000b:00 = 00000001 00000002 00000100 00000000 | ................
CPUID 0000000b:01 = 00000004 00000008 00000201 00000000 | ................
CPUID 0000000c:00 = 00000000 00000000 00000000 00000000 | ................
CPUID 0000000d:00 = 00000007 00000340 00000340 00000000 | ....@...@.......
CPUID 0000000d:01 = 00000001 00000000 00000000 00000000 | ................
CPUID 0000000d:02 = 00000100 00000240 00000000 00000000 | ....@...........
CPUID 40000000:00 = 00000000 00000000 00000000 00000000 | ................
CPUID 80000000:00 = 80000008 00000000 00000000 00000000 | ................
CPUID 80000001:00 = 00000000 00000000 00000021 2c100000 | ........!......,
CPUID 80000002:00 = 65746e49 2952286c 726f4320 4d542865 | Intel(R) Core(TM
CPUID 80000003:00 = 37692029 3737342d 50432030 20402055 | ) i7-4770 CPU @ 
CPUID 80000004:00 = 30342e33 007a4847 00000000 00000000 | 3.40GHz.........
CPUID 80000005:00 = 00000000 00000000 00000000 00000000 | ................
CPUID 80000006:00 = 00000000 00000000 01006040 00000000 | ........@`......
CPUID 80000007:00 = 00000000 00000000 00000000 00000100 | ................
CPUID 80000008:00 = 00003027 00000000 00000000 00000000 | '0..............
CPUID 80860000:00 = 00000000 00000000 00000000 00000000 | ................
CPUID c0000000:00 = 00000000 00000000 00000000 00000000 | ................
CPU 1:
CPUID 00000000:00 = 0000000d 756e6547 6c65746e 49656e69 | ....GenuntelineI
CPUID 00000001:00 = 000306c3 01100800 7ffafbff bfebfbff | ................
CPUID 00000002:00 = 76036301 00f0b5ff 00000000 00c10000 | .c.v............
CPUID 00000003:00 = 00000000 00000000 00000000 00000000 | ................
CPUID 00000004:00 = 1c004121 01c0003f 0000003f 00000000 | !A..?...?.......
CPUID 00000004:01 = 1c004122 01c0003f 0000003f 00000000 | "A..?...?.......
CPUID 00000004:02 = 1c004143 01c0003f 000001ff 00000000 | CA..?...........
CPUID 00000004:03 = 1c03c163 03c0003f 00001fff 00000006 | c...?...........
CPUID 00000004:04 = 00000000 00000000 00000000 00000000 | ................
CPUID 00000005:00 = 00000040 00000040 00000003 00042120 | @...@....... !..
CPUID 00000006:00 = 00000075 00000002 00000009 00000000 | u...............
CPUID 00000007:00 = 00000000 000027ab 00000000 00000000 | .....'..........
CPUID 00000008:00 = 00000000 00000000 00000000 00000000 | ................
CPUID 00000009:00 = 00000000 00000000 00000000 00000000 | ................
CPUID 0000000a:00 = 07300403 00000000 00000000 00000603 | ..0.............
CPUID 0000000b:00 = 00000001 00000002 00000100 00000001 | ................
CPUID 0000000b:01 = 00000004 00000008 00000201 00000001 | ................
CPUID 0000000c:00 = 00000000 00000000 00000000 00000000 | ................
CPUID 0000000d:00 = 00000007 00000340 00000340 00000000 | ....@...@.......
CPUID 0000000d:01 = 00000001 00000000 00000000 00000000 | ................
CPUID 0000000d:02 = 00000100 00000240 00000000 00000000 | ....@...........
CPUID 40000000:00 = 00000000 00000000 00000000 00000000 | ................
CPUID 80000000:00 = 80000008 00000000 00000000 00000000 | ................
CPUID 80000001:00 = 00000000 00000000 00000021 2c100000 | ........!......,
CPUID 80000002:00 = 65746e49 2952286c 726f4320 4d542865 | Intel(R) Core(TM
CPUID 80000003:00 = 37692029 3737342d 50432030 20402055 | ) i7-4770 CPU @ 
CPUID 80000004:00 = 30342e33 007a4847 00000000 00000000 | 3.40GHz.........
CPUID 80000005:00 = 00000000 00000000 00000000 00000000 | ................
CPUID 80000006:00 = 00000000 00000000 01006040 00000000 | ........@`......
CPUID 80000007:00 = 00000000 00000000 00000000 00000100 | ................
CPUID 80000008:00 = 00003027 00000000 00000000 00000000 | '0..............
CPUID 80860000:00 = 00000000 00000000 00000000 00000000 | ................
CPUID c0000000:00 = 00000000 00000000 00000000 00000000 | ................
CPU 2:
CPUID 00000000:00 = 0000000d 756e6547 6c65746e 49656e69 | ....GenuntelineI
CPUID 00000001:00 = 000306c3 02100800 7ffafbff bfebfbff | ................
CPUID 00000002:00 = 76036301 00f0b5ff 00000000 00c10000 | .c.v............
CPUID 00000003:00 = 00000000 00000000 00000000 00000000 | ................
CPUID 00000004:00 = 1c004121 01c0003f 0000003f 00000000 | !A..?...?.......
CPUID 00000004:01 = 1c004122 01c0003f 0000003f 00000000 | "A..?...?.......
CPUID 00000004:02 = 1c004143 01c0003f 000001ff 00000000 | CA..?...........
CPUID 00000004:03 = 1c03c163 03c0003f 00001fff 00000006 | c...?...........
CPUID 00000004:04 = 00000000 00000000 00000000 00000000 | ................
CPUID 00000005:00 = 00000040 00000040 00000003 00042120 | @...@....... !..
CPUID 00000006:00 = 00000075 00000002 00000009 00000000 | u...............
CPUID 00000007:00 = 00000000 000027ab 00000000 00000000 | .....'..........
CPUID 00000008:00 = 00000000 00000000 00000000 00000000 | ................
CPUID 00000009:00 = 00000000 00000000 00000000 00000000 | ................
CPUID 0000000a:00 = 07300403 00000000 00000000 00000603 | ..0.............
CPUID 0000000b:00 = 00000001 00000002 00000100 00000002 | ................
CPUID 0000000b:01 = 00000004 00000008 00000201 00000002 | ................
CPUID 0000000c:00 = 00000000 00000000 00000000 00000000 | ................
CPUID 0000000d:00 = 00000007 00000340 00000340 00000000 | ....@...@.......
CPUID 0000000d:01 = 00000001 00000000 00000000 00000000 | ................
CPUID 0000000d:02 = 00000100 00000240 00000000 00000000 | ....@...........
CPUID 40000000:00 = 00000000 00000000 00000000 00000000 | ................
CPUID 80000000:00 = 80000008 00000000 00000000 00000000 | ................
CPUID 80000001:00 = 00000000 00000000 00000021 2c100000 | ........!......,
CPUID 80000002:00 = 65746e49 2952286c 726f4320 4d542865 | Intel(R) Core(TM
CPUID 80000003:00 = 37692029 3737342d 50432030 20402055 | ) i7-4770 CPU @ 
CPUID 80000004:00 = 30342e33 007a4847 00000000 00000000 | 3.40GHz.........
CPUID 80000005:00 = 00000000 00000000 00000000 00000000 | ................
CPUID 80000006:00 = 00000000 00000000 01006040 00000000 | ........@`......
CPUID 80000007:00 = 00000000 00000000 00000000 00000100 | ................
CPUID 80000008:00 = 00003027 00000000 00000000 00000000 | '0..............
CPUID 80860000:00 = 00000000 00000000 00000000 00000000 | ................
CPUID c0000000:00 = 00000000 00000000 00000000 00000000 | ................
CPU 3:
CPUID 00000000:00 = 0000000d 756e6547 6c65746e 49656e69 | ....GenuntelineI
CPUID 00000001:00 = 000306c3 03100800 7ffafbff bfebfbff | ................
CPUID 00000002:00 = 76036301 00f0b5ff 00000000 00c10000 | .c.v............
CPUID 00000003:00 = 00000000 00000000 00000000 00000000 | ................
CPUID 00000004:00 = 1c004121 01c0003f 0000003f 00000000 | !A..?...?.......
CPUID 00000004:01 = 1c004122 01c0003f 0000003f 00000000 | "A..?...?.......
CPUID 00000004:02 = 1c004143 01c0003f 000001ff 00000000 | CA..?...........
CPUID 00000004:03 = 1c03c163 03c0003f 00001fff 00000006 | c...?...........
CPUID 00000004:04 = 00000000 00000000 00000000 00000000 | ................
CPUID 00000005:00 = 00000040 00000040 00000003 00042120 | @...@....... !..
CPUID 00000006:00 = 00000075 00000002 00000009 00000000 | u...............
CPUID 00000007:00 = 00000000 000027ab 00000000 00000000 | .....'..........
CPUID 00000008:00 = 00000000 00000000 00000000 00000000 | ................
CPUID 00000009:00 = 00000000 00000000 00000000 00000000 | ................
CPUID 0000000a:00 = 07300403 00000000 00000000 00000603 | ..0.............
CPUID 0000000b:00 = 00000001 00000002 00000100 00000003 | ................
CPUID 0000000b:01 = 00000004 00000008 00000201 00000003 | ................
CPUID 0000000c:00 = 00000000 00000000 00000000 00000000 | ................
CPUID 0000000d:00 = 00000007 00000340 00000340 00000000 | ....@...@.......
CPUID 0000000d:01 = 00000001 00000000 00000000 00000000 | ................
CPUID 0000000d:02 = 00000100 00000240 00000000 00000000 | ....@...........
CPUID 40000000:00 = 00000000 00000000 00000000 00000000 | ................
CPUID 80000000:00 = 80000008 00000000 00000000 00000000 | ................
CPUID 80000001:00 = 00000000 00000000 00000021 2c100000 | ........!......,
CPUID 80000002:00 = 65746e49 2952286c 726f4320 4d542865 | Intel(R) Core(TM
CPUID 80000003:00 = 37692029 3737342d 50432030 20402055 | ) i7-4770 CPU @ 
CPUID 80000004:00 = 30342e33 007a4847 00000000 00000000 | 3.40GHz.........
CPUID 80000005:00 = 00000000 00000000 00000000 00000000 | ................
CPUID 80000006:00 = 00000000 00000000 01006040 00000000 | ........@`......
CPUID 80000007:00 = 00000000 00000000 00000000 00000100 | ................
CPUID 80000008:00 = 00003027 00000000 00000000 00000000 | '0..............
CPUID 80860000:00 = 00000000 00000000 00000000 00000000 | ................
CPUID c0000000:00 = 00000000 00000000 00000000 00000000 | ................
CPU 4:
CPUID 00000000:00 = 0000000d 756e6547 6c65746e 49656e69 | ....GenuntelineI
CPUID 00000001:00 = 000306c3 04100800 7ffafbff bfebfbff | ................
CPUID 00000002:00 = 76036301 00f0b5ff 00000000 00c10000 | .c.v............
CPUID 00000003:00 = 00000000 00000000 00000000 00000000 | ................
CPUID 00000004:00 = 1c004121 01c0003f 0000003f 00000000 | !A..?...?.......
CPUID 00000004:01 = 1c004122 01c0003f 0000003f 00000000 | "A..?...?.......
CPUID 00000004:02 = 1c004143 01c0003f 000001ff 00000000 | CA..?...........
CPUID 00000004:03 = 1c03c163 03c0003f 00001fff 00000006 | c...?...........
CPUID 00000004:04 = 00000000 00000000 00000000 00000000 | ................
CPUID 00000005:00 = 00000040 00000040 00000003 00042120 | @...@....... !..
CPUID 00000006:00 = 00000075 00000002 00000009 00000000 | u...............
CPUID 00000007:00 = 00000000 000027ab 00000000 00000000 | .....'..........
CPUID 00000008:00 = 00000000 00000000 00000000 00000000 | ................
CPUID 00000009:00 = 00000000 00000000 00000000 00000000 | ................
CPUID 0000000a:00 = 07300403 00000000 00000000 00000603 | ..0.............
CPUID 0000000b:00 = 00000001 00000002 00000100 00000004 | ................
CPUID 0000000b:01 = 00000004 00000008 00000201 00000004 | ................
CPUID 0000000c:00 = 00000000 00000000 00000000 00000000 | ................
CPUID 0000000d:00 = 00000007 00000340 00000340 00000000 | ....@...@.......
CPUID 0000000d:01 = 00000001 00000000 00000000 00000000 | ................
CPUID 0000000d:02 = 00000100 00000240 00000000 00000000 | ....@...........
CPUID 40000000:00 = 00000000 00000000 00000000 00000000 | ................
CPUID 80000000:00 = 80000008 00000000 00000000 00000000 | ................
CPUID 80000001:00 = 00000000 00000000 00000021 2c100000 | ........!......,
CPUID 80000002:00 = 65746e49 2952286c 726f4320 4d542865 | Intel(R) Core(TM
CPUID 80000003:00 = 37692029 3737342d 50432030 20402055 | ) i7-4770 CPU @ 
CPUID 80000004:00 = 30342e33 007a4847 00000000 00000000 | 3.40GHz.........
CPUID 80000005:00 = 00000000 00000000 00000000 00000000 | ................
CPUID 80000006:00 = 00000000 00000000 01006040 00000000 | ........@`......
CPUID 80000007:00 = 00000000 00000000 00000000 00000100 | ................
CPUID 80000008:00 = 00003027 00000000 00000000 00000000 | '0..............
CPUID 80860000:00 = 00000000 00000000 00000000 00000000 | ................
CPUID c0000000:00 = 00000000 00000000 00000000 00000000 | ................
CPU 5:
CPUID 00000000:00 = 0000000d 756e6547 6c65746e 49656e69 | ....GenuntelineI
CPUID 00000001:00 = 000306c3 05100800 7ffafbff bfebfbff | ................
CPUID 00000002:00 = 76036301 00f0b5ff 00000000 00c10000 | .c.v............
CPUID 00000003:00 = 00000000 00000000 00000000 00000000 | ................
CPUID 00000004:00 = 1c004121 01c0003f 0000003f 00000000 | !A..?...?.......
CPUID 00000004:01 = 1c004122 01c0003f 0000003f 00000000 | "A..?...?.......
CPUID 00000004:02 = 1c004143 01c0003f 000001ff 00000000 | CA..?...........
CPUID 00000004:03 = 1c03c163 03c0003f 00001fff 00000006 | c...?...........
CPUID 00000004:04 = 00000000 00000000 00000000 00000000 | ................
CPUID 00000005:00 = 00000040 00000040 00000003 00042120 | @...@....... !..
CPUID 00000006:00 = 00000075 00000002 00000009 00000000 | u...............
CPUID 00000007:00 = 00000000 000027ab 00000000 00000000 | .....'..........
CPUID 00000008:00 = 00000000 00000000 00000000 00000000 | ................
CPUID 00000009:00 = 00000000 00000000 00000000 00000000 | ................
CPUID 0000000a:00 = 07300403 00000000 00000000 00000603 | ..0.............
CPUID 0000000b:00 = 00000001 00000002 00000100 00000005 | ................
CPUID 0000000b:01 = 00000004 00000008 00000201 00000005 | ................
CPUID 0000000c:00 = 00000000 00000000 00000000 00000000 | ................
CPUID 0000000d:00 = 00000007 00000340 00000340 00000000 | ....@...@.......
CPUID 0000000d:01 = 00000001 00000000 00000000 00000000 | ................
CPUID 0000000d:02 = 00000100 00000240 00000000 00000000 | ....@...........
CPUID 40000000:00 = 00000000 00000000 00000000 00000000 | ................
CPUID 80000000:00 = 80000008 00000000 00000000 00000000 | ................
CPUID 80000001:00 = 00000000 00000000 00000021 2c100000 | ........!......,
CPUID 80000002:00 = 65746e49 2952286c 726f4320 4d542865 | Intel(R) Core(TM
CPUID 80000003:00 = 37692029 3737342d 50432030 20402055 | ) i7-4770 CPU @ 
CPUID 80000004:00 = 30342e33 007a4847 00000000 00000000 | 3.40GHz.........
CPUID 80000005:00 = 00000000 00000000 00000000 00000000 | ................
CPUID 80000006:00 = 00000000 00000000 01006040 00000000 | ........@`......
CPUID 80000007:00 = 00000000 00000000 00000000 00000100 | ................
CPUID 80000008:00 = 00003027 00000000 00000000 00000000 | '0..............
CPUID 80860000:00 = 00000000 00000000 00000000 00000000 | ................
CPUID c0000000:00 = 00000000 00000000 00000000 00000000 | ................
CPU 6:
CPUID 00000000:00 = 0000000d 756e6547 6c65746e 49656e69 | ....GenuntelineI
CPUID 00000001:00 = 000306c3 06100800 7ffafbff bfebfbff | ................
CPUID 00000002:00 = 76036301 00f0b5ff 00000000 00c10000 | .c.v............
CPUID 00000003:00 = 00000000 00000000 00000000 00000000 | ................
CPUID 00000004:00 = 1c004121 01c0003f 0000003f 00000000 | !A..?...?.......
CPUID 00000004:01 = 1c004122 01c0003f 0000003f 00000000 | "A..?...?.......
CPUID 00000004:02 = 1c004143 01c0003f 000001ff 00000000 | CA..?...........
CPUID 00000004:03 = 1c03c163 03c0003f 00001fff 00000006 | c...?...........
CPUID 00000004:04 = 00000000 00000000 00000000 00000000 | ................
CPUID 00000005:00 = 00000040 00000040 00000003 00042120 | @...@....... !..
CPUID 00000006:00 = 00000075 00000002 00000009 00000000 | u...............
CPUID 00000007:00 = 00000000 000027ab 00000000 00000000 | .....'..........
CPUID 00000008:00 = 00000000 00000000 00000000 00000000 | ................
CPUID 00000009:00 = 00000000 00000000 00000000 00000000 | ................
CPUID 0000000a:00 = 07300403 00000000 00000000 00000603 | ..0.............
CPUID 0000000b:00 = 00000001 00000002 00000100 00000006 | ................
CPUID 0000000b:01 = 00000004 00000008 00000201 00000006 | ................
CPUID 0000000c:00 = 00000000 00000000 00000000 00000000 | ................
CPUID 0000000d:00 = 00000007 00000340 00000340 00000000 | ....@...@.......
CPUID 0000000d:01 = 00000001 00000000 00000000 00000000 | ................
CPUID 0000000d:02 = 00000100 00000240 00000000 00000000 | ....@...........
CPUID 40000000:00 = 00000000 00000000 00000000 00000000 | ................
CPUID 80000000:00 = 80000008 00000000 00000000 00000000 | ................
CPUID 80000001:00 = 00000000 00000000 00000021 2c100000 | ........!......,
CPUID 80000002:00 = 65746e49 2952286c 726f4320 4d542865 | Intel(R) Core(TM
CPUID 80000003:00 = 37692029 3737342d 50432030 20402055 | ) i7-4770 CPU @ 
CPUID 80000004:00 = 30342e33 007a4847 00000000 00000000 | 3.40GHz.........
CPUID 80000005:00 = 00000000 00000000 00000000 00000000 | ................
CPUID 80000006:00 = 00000000 00000000 01006040 00000000 | ........@`......
CPUID 80000007:00 = 00000000 00000000 00000000 00000100 | ................
CPUID 80000008:00 = 00003027 00000000 00000000 00000000 | '0..............
CPUID 80860000:00 = 00000000 00000000 00000000 00000000 | ................
CPUID c0000000:00 = 00000000 00000000 00000000 00000000 | ................
CPU 7:
CPUID 00000000:00 = 0000000d 756e6547 6c65746e 49656e69 | ....GenuntelineI
CPUID 00000001:00 = 000306c3 07100800 7ffafbff bfebfbff | ................
CPUID 00000002:00 = 76036301 00f0b5ff 00000000 00c10000 | .c.v............
CPUID 00000003:00 = 00000000 00000000 00000000 00000000 | ................
CPUID 00000004:00 = 1c004121 01c0003f 0000003f 00000000 | !A..?...?.......
CPUID 00000004:01 = 1c004122 01c0003f 0000003f 00000000 | "A..?...?.......
CPUID 00000004:02 = 1c004143 01c0003f 000001ff 00000000 | CA..?...........
CPUID 00000004:03 = 1c03c163 03c0003f 00001fff 00000006 | c...?...........
CPUID 00000004:04 = 00000000 00000000 00000000 00000000 | ................
CPUID 00000005:00 = 00000040 00000040 00000003 00042120 | @...@....... !..
CPUID 00000006:00 = 00000075 00000002 00000009 00000000 | u...............
CPUID 00000007:00 = 00000000 000027ab 00000000 00000000 | .....'..........
CPUID 00000008:00 = 00000000 00000000 00000000 00000000 | ................
CPUID 00000009:00 = 00000000 00000000 00000000 00000000 | ................
CPUID 0000000a:00 = 07300403 00000000 00000000 00000603 | ..0.............
CPUID 0000000b:00 = 00000001 00000002 00000100 00000007 | ................
CPUID 0000000b:01 = 00000004 00000008 00000201 00000007 | ................
CPUID 0000000c:00 = 00000000 00000000 00000000 00000000 | ................
CPUID 0000000d:00 = 00000007 00000340 00000340 00000000 | ....@...@.......
CPUID 0000000d:01 = 00000001 00000000 00000000 00000000 | ................
CPUID 0000000d:02 = 00000100 00000240 00000000 00000000 | ....@...........
CPUID 40000000:00 = 00000000 00000000 00000000 00000000 | ................
CPUID 80000000:00 = 80000008 00000000 00000000 00000000 | ................
CPUID 80000001:00 = 00000000 00000000 00000021 2c100000 | ........!......,
CPUID 80000002:00 = 65746e49 2952286c 726f4320 4d542865 | Intel(R) Core(TM
CPUID 80000003:00 = 37692029 3737342d 50432030 20402055 | ) i7-4770 CPU @ 
CPUID 80000004:00 = 30342e33 007a4847 00000000 00000000 | 3.40GHz.........
CPUID 80000005:00 = 00000000 00000000 00000000 00000000 | ................
CPUID 80000006:00 = 00000000 00000000 01006040 00000000 | ........@`......
CPUID 80000007:00 = 00000000 00000000 00000000 00000100 | ................
CPUID 80000008:00 = 00003027 00000000 00000000 00000000 | '0..............
CPUID 80860000:00 = 00000000 00000000 00000000 00000000 | ................
CPUID c0000000:00 = 00000000 00000000 00000000 00000000 | ................
