CPU 0:
CPUID 00000000:00 = 0000000b 756e6547 6c65746e 49656e69 | ....GenuntelineI
CPUID 00000001:00 = 000206f2 00400800 02bee3ff bfebfbff | ......@.........
CPUID 00000002:00 = 55035a01 00f0b2ff 00000000 00ca0000 | .Z.U............
CPUID 00000003:00 = 00000000 00000000 00000000 00000000 | ................
CPUID 00000004:00 = 7c004121 01c0003f 0000003f 00000000 | !A.|?...?.......
CPUID 00000004:01 = 7c004122 00c0003f 0000007f 00000000 | "A.|?...........
CPUID 00000004:02 = 7c004143 01c0003f 000001ff 00000000 | CA.|?...........
CPUID 00000004:03 = 7c0fc163 05c0003f 00004fff 00000006 | c..|?....O......
CPUID 00000004:04 = 00000000 00000000 00000000 00000000 | ................
CPUID 00000005:00 = 00000040 00000040 00000003 00001120 | @...@....... ...
CPUID 00000006:00 = 00000005 00000001 00000001 00000000 | ................
CPUID 00000007:00 = 00000000 00000000 00000000 00000000 | ................
CPUID 00000008:00 = 00000000 00000000 00000000 00000000 | ................
CPUID 00000009:00 = 00000000 00000000 00000000 00000000 | ................
CPUID 0000000a:00 = 07300403 00000004 00000000 00000603 | ..0.............
CPUID 0000000b:00 = 00000001 00000002 00000100 00000000 | ................
CPUID 0000000b:01 = 00000006 00000014 00000201 00000000 | ................
CPUID 40000000:00 = 00000000 00000000 00000000 00000000 | ................
CPUID 80000000:00 = 80000008 00000000 00000000 00000000 | ................
CPUID 80000001:00 = 00000000 00000000 00000001 2c100800 | ...............,
CPUID 80000002:00 = 20202020 49202020 6c65746e 20295228 |        Intel(R) 
CPUID 80000003:00 = 6e6f6558 20295228 20555043 202d3745 | Xeon(R) CPU E7- 
CPUID 80000004:00 = 30373834 20402020 30342e32 007a4847 | 4870  @ 2.40GHz.
CPUID 80000005:00 = 00000000 00000000 00000000 00000000 | ................
CPUID 80000006:00 = 00000000 00000000 01006040 00000000 | ........@`......
CPUID 80000007:00 = 00000000 00000000 00000000 00000100 | ................
CPUID 80000008:00 = 0000302c 00000000 00000000 00000000 | ,0..............
CPUID 80860000:00 = 00000000 00000000 00000000 00000000 | ................
CPUID c0000000:00 = 00000000 00000000 00000000 00000000 | ................
