CPU 0:
CPUID 00000000:00 = 00000002 756e6547 6c65746e 49656e69 | ....GenuntelineI
CPUID 00000001:00 = 00000f27 0001080a 00004400 bfebfbff | '........D......
CPUID 00000002:00 = 665b5101 00000000 00000000 003b7040 | .Q[f........@p;.
CPUID 40000000:00 = 00000000 00000000 00000000 00000000 | ................
CPUID 80000000:00 = 80000004 00000000 00000000 00000000 | ................
CPUID 80000001:00 = 00000000 00000000 00000000 00000000 | ................
CPUID 80000002:00 = 20202020 20202020 20202020 20202020 |                 
CPUID 80000003:00 = 65746e49 2952286c 6c654320 6e6f7265 | Intel(R) Celeron
CPUID 80000004:00 = 20295228 20555043 30302e32 007a4847 | (R) CPU 2.00GHz.
CPUID 80860000:00 = 00000000 00000000 00000000 00000000 | ................
CPUID c0000000:00 = 00000000 00000000 00000000 00000000 | ................
