CPU 0:
CPUID 00000000:00 = 00000002 646f6547 43534e20 79622065 | ....Geod NSCe by
CPUID 00000001:00 = 00000540 00000000 00000000 00808131 | @...........1...
CPUID 00000002:00 = 00007001 00000000 00000000 00000080 | .p..............
CPUID 40000000:00 = 00000000 00000000 00000000 00000000 | ................
CPUID 80000000:00 = 80000005 00000000 00000000 00000000 | ................
CPUID 80000001:00 = 00000540 00000000 00000000 01818131 | @...........1...
CPUID 80000002:00 = 646f6547 4d542865 6e492029 72676574 | Geode(TM) Integr
CPUID 80000003:00 = 64657461 6f725020 73736563 6220726f | ated Processor b
CPUID 80000004:00 = 614e2079 6e6f6974 53206c61 00696d65 | y National Semi.
CPUID 80000005:00 = 00000000 00007001 00000080 00000000 | .....p..........
CPUID 80860000:00 = 00000000 00000000 00000000 00000000 | ................
CPUID c0000000:00 = 00000000 00000000 00000000 00000000 | ................
