CPU 0:
CPUID 00000000:00 = 00000001 646f6547 43534e20 79622065 | ....Geod NSCe by
CPUID 00000001:00 = 00000551 00000000 00000000 0080a93d | Q...........=...
CPUID 40000000:00 = 00000000 00000000 00000000 00000000 | ................
CPUID 80000000:00 = 80000006 646f6547 43534e20 79622065 | ....Geod NSCe by
CPUID 80000001:00 = 00000551 00000000 00000000 c0c0a93d | Q...........=...
CPUID 80000002:00 = 646f6547 4d542865 6e492029 72676574 | Geode(TM) Integr
CPUID 80000003:00 = 64657461 6f725020 73736563 6220726f | ated Processor b
CPUID 80000004:00 = 614e2079 6e6f6974 53206c61 00696d65 | y National Semi.
CPUID 80000005:00 = 00000000 ff08ff08 10040120 10040120 | ........ ... ...
CPUID 80000006:00 = 0000f004 00002040 00000000 00000000 | ....@ ..........
CPUID 80860000:00 = 00000000 00000000 00000000 00000000 | ................
CPUID c0000000:00 = 00000000 00000000 00000000 00000000 | ................
