CPU 0:
CPUID 00000000:00 = 00000001 746e6543 736c7561 48727561 | ....CentaulsaurH
CPUID 00000001:00 = 000006a9 00010800 00000181 a7c9bbff | ................
CPUID 40000000:00 = 00000000 00000000 00000000 00000000 | ................
CPUID 80000000:00 = 80000006 00000000 00000000 00000000 | ................
CPUID 80000001:00 = 00000000 00000000 00000000 00100000 | ................
CPUID 80000002:00 = 20202020 20202020 20202020 20202020 |                 
CPUID 80000003:00 = 56202020 45204149 65687473 72702072 |    VIA Esther pr
CPUID 80000004:00 = 7365636f 20726f73 30303531 007a484d | ocessor 1500MHz.
CPUID 80000005:00 = 00000000 08800880 40040140 40040140 | ........@..@@..@
CPUID 80000006:00 = 00000000 00000000 0080a140 00000000 | ........@.......
CPUID 80860000:00 = 00000000 00000000 00000000 00000000 | ................
CPUID c0000000:00 = c0000002 00000000 00000000 00000000 | ................
CPUID c0000001:00 = 00000000 00000000 00000000 00003fcc | .............?..
CPUID c0000002:00 = 00002c00 08000f13 08100f13 43c00000 | .,.............C
