CPU 0:
CPUID 00000000:00 = 00000001 746e6543 736c7561 48727561 | ....CentaulsaurH
CPUID 00000001:00 = 00000689 00000000 00000000 00803135 | ............51..
CPUID 40000000:00 = 00000000 00000000 00000000 00000000 | ................
CPUID 80000000:00 = 80000006 00000000 00000000 00000000 | ................
CPUID 80000001:00 = 00000689 00000000 00000000 80803135 | ............51..
CPUID 80000002:00 = 20414956 45203343 0061727a 00000000 | VIA C3 Ezra.....
CPUID 80000003:00 = 00000000 00000000 00000000 00000000 | ................
CPUID 80000004:00 = 00000000 00000000 00000000 00000000 | ................
CPUID 80000005:00 = 00000000 08800880 40040120 40040120 | ........ ..@ ..@
CPUID 80000006:00 = 00000000 00000000 40040120 00000000 | ........ ..@....
CPUID 80860000:00 = 00000000 00000000 00000000 00000000 | ................
CPUID c0000000:00 = 00000000 00000000 00000000 00000000 | ................
