CPU 0:
CPUID 00000000:00 = 00000001 746e6543 736c7561 48727561 | ....CentaulsaurH
CPUID 00000001:00 = 00000660 c1704000 c1705f8c 008031b5 | `....@p.._p..1..
CPUID 40000000:00 = 00000000 00000000 00000000 00000000 | ................
CPUID 80000000:00 = 80000005 c1704000 c1705f8c 00000010 | .....@p.._p.....
CPUID 80000001:00 = 00000660 c1704000 c1705f8c 808031b5 | `....@p.._p..1..
CPUID 80000002:00 = 20414956 756d6153 00006c65 0000004d | VIA Samuel..M...
CPUID 80000003:00 = 00000000 00000000 00000000 00000000 | ................
CPUID 80000004:00 = 00000000 00000000 00000000 00000000 | ................
CPUID 80000005:00 = 80000005 08800880 40040120 40040120 | ........ ..@ ..@
CPUID 80860000:00 = 00000000 00000000 00000000 00000000 | ................
CPUID c0000000:00 = 00000000 00000000 00000000 00000000 | ................
