CPU 0:
CPUID 00000000:00 = 00000001 746e6543 736c7561 48727561 | ....CentaulsaurH
CPUID 00000001:00 = 000006d0 00000800 00004181 a7c9bbff | .........A......
CPUID 40000000:00 = 00000000 00000000 00000000 00000000 | ................
CPUID 80000000:00 = 80000006 00000000 00000000 00000000 | ................
CPUID 80000001:00 = 00000000 00000000 00000000 00100000 | ................
CPUID 80000002:00 = 20202020 20202020 20202020 20202020 |                 
CPUID 80000003:00 = 20202020 41495620 2d374320 7250204d |      VIA C7-M Pr
CPUID 80000004:00 = 7365636f 20726f73 30303231 007a484d | ocessor 1200MHz.
CPUID 80000005:00 = 00000000 08800880 40040140 40040140 | ........@..@@..@
CPUID 80000006:00 = 00000000 00000000 0080a140 00000000 | ........@.......
CPUID 80860000:00 = 00000000 00000000 00000000 00000000 | ................
CPUID c0000000:00 = c0000003 00000000 00000000 00000000 | ................
CPUID c0000001:00 = 00000000 00000001 00000000 0000ffcc | ................
CPUID c0000002:00 = 00003a00 04000c09 04060c09 43040000 | .:.............C
CPUID c0000003:00 = 94d53fde 7980bebf 366b736b ed908777 | .?.....yksk6w...
