CPU 0:
CPUID 00000000:00 = 0000000a 746e6543 736c7561 48727561 | ....CentaulsaurH
CPUID 00000001:00 = 000006fa 00020800 008863a9 afc9fbff | .........c......
CPUID 00000002:00 = 02b3b001 00000000 00000000 2c04307d | ............}0.,
CPUID 00000003:00 = 00000000 00000000 00000000 00000000 | ................
CPUID 00000004:00 = 00000000 00000000 00000000 00000000 | ................
CPUID 00000005:00 = 00000040 00000040 00000003 00022220 | @...@....... "..
CPUID 00000006:00 = 00000002 00000000 00000000 00000000 | ................
CPUID 00000007:00 = 00000000 00000000 00000000 00000000 | ................
CPUID 00000008:00 = 00000000 00000000 00000000 00000000 | ................
CPUID 00000009:00 = 00000000 00000000 00000000 00000000 | ................
CPUID 0000000a:00 = 06280202 00000000 00000000 00000503 | ..(.............
CPUID 40000000:00 = 00000000 00000000 00000000 00000000 | ................
CPUID 80000000:00 = 80000008 00000000 00000000 00000000 | ................
CPUID 80000001:00 = 00000000 00000000 00000001 20100800 | ............... 
CPUID 80000002:00 = 20202020 20202020 20202020 56202020 |                V
CPUID 80000003:00 = 4e204149 206f6e61 636f7270 6f737365 | IA Nano processo
CPUID 80000004:00 = 20202072 40202020 30303831 007a484d | r      @1800MHz.
CPUID 80000005:00 = 00000000 08800880 40100140 40100140 | ........@..@@..@
CPUID 80000006:00 = 00000000 00000000 04008140 00000000 | ........@.......
CPUID 80000007:00 = 00000000 00000000 00000000 00000000 | ................
CPUID 80000008:00 = 00003024 00000000 00000000 00000000 | $0..............
CPUID 80860000:00 = 00000000 00000000 00000000 00000000 | ................
CPUID c0000000:00 = c0000004 00000000 00000000 00000000 | ................
CPUID c0000001:00 = 000006fa 00000000 00000000 1ec13dcc | .............=..
CPUID c0000002:00 = 00000000 00000000 00000000 00000000 | ................
CPUID c0000003:00 = 00000000 00000000 00000000 00000000 | ................
CPUID c0000004:00 = 0000001c 08001263 08471263 00000000 | ....c...c.G.....
